tcpdump: verbose output suppressed, use -v[v]... for full protocol decode
listening on lo, link-type EN10MB (Ethernet), snapshot length 262144 bytes
14:59:24.218882 IP6 localhost.51548 > localhost.5000: Flags [S], seq 1047614916, win 65535, options [mss 65476,sackOK,TS val 1107446479 ecr 0,nop,wscale 9], length 0
`..c.(.@.................................\..>qU..........0.........
B.J........	
14:59:24.218959 IP6 localhost.5000 > localhost.51548: Flags [R.], seq 0, ack 1047614917, win 0, length 0
`.-1...@...................................\....>qU.P.......
14:59:24.220147 IP localhost.43108 > localhost.5000: Flags [S], seq 3131112881, win 65535, options [mss 65495,sackOK,TS val 1314682525 ecr 0,nop,wscale 9], length 0
E..<*.@.@............d...............0.........
N\v........	
14:59:24.220243 IP localhost.5000 > localhost.43108: Flags [S.], seq 2719742899, ack 3131112882, win 65535, options [mss 65495,sackOK,TS val 1314682525 ecr 1314682525,nop,wscale 9], length 0
E..<..@.@.<............d.............0.........
N\v.N\v....	
14:59:24.220312 IP localhost.43108 > localhost.5000: Flags [.], ack 1, win 128, options [nop,nop,TS val 1314682525 ecr 1314682525], length 0
E..4*.@.@............d...............(.....
N\v.N\v.
14:59:24.223338 IP6 localhost.51554 > localhost.5000: Flags [S], seq 1711777682, win 65535, options [mss 65476,sackOK,TS val 1107446483 ecr 0,nop,wscale 9], length 0
`	.M.(.@.................................b..f............0.........
B.J........	
14:59:24.223360 IP6 localhost.5000 > localhost.51554: Flags [R.], seq 0, ack 1711777683, win 0, length 0
`	.....@...................................b....f...P.......
14:59:24.223782 IP localhost.43114 > localhost.5000: Flags [S], seq 3581906305, win 65535, options [mss 65495,sackOK,TS val 1314682529 ecr 0,nop,wscale 9], length 0
E..<Zy@.@..@.........j...............0.........
N\v........	
14:59:24.223813 IP localhost.5000 > localhost.43114: Flags [S.], seq 158383468, ack 3581906306, win 65535, options [mss 65495,sackOK,TS val 1314682529 ecr 1314682529,nop,wscale 9], length 0
E..<..@.@.<............j	p.l.........0.........
N\v.N\v....	
14:59:24.223833 IP localhost.43114 > localhost.5000: Flags [.], ack 1, win 128, options [nop,nop,TS val 1314682529 ecr 1314682529], length 0
E..4Zz@.@..G.........j......	p.m.....(.....
N\v.N\v.
14:59:24.224283 IP localhost.43108 > localhost.5000: Flags [P.], seq 1:557, ack 1, win 128, options [nop,nop,TS val 1314682529 ecr 1314682525], length 556
E..`*.@.@............d...............U.....
N\v.N\v.OPTIONS /api/log HTTP/1.1
Host: localhost:5000
Connection: keep-alive
Accept: */*
Access-Control-Request-Method: POST
Access-Control-Request-Headers: content-type
Origin: http://localhost:3000
User-Agent: Mozilla/5.0 (Linux; Android 10; K) AppleWebKit/537.36 (KHTML, like Gecko) Chrome/138.0.0.0 Mobile Safari/537.36
Sec-Fetch-Mode: cors
X-Requested-With: com.duckduckgo.mobile.android
Sec-Fetch-Site: same-site
Sec-Fetch-Dest: empty
Referer: http://localhost:3000/
Accept-Encoding: gzip, deflate, br, zstd
Accept-Language: en-US,en;q=0.9


14:59:24.224312 IP localhost.5000 > localhost.43108: Flags [.], ack 557, win 384, options [nop,nop,TS val 1314682529 ecr 1314682529], length 0
E..4m.@.@..............d.............(.....
N\v.N\v.
14:59:24.224438 IP localhost.43114 > localhost.5000: Flags [P.], seq 1:557, ack 1, win 128, options [nop,nop,TS val 1314682529 ecr 1314682529], length 556
E..`Z{@.@............j......	p.m.....U.....
N\v.N\v.OPTIONS /api/log HTTP/1.1
Host: localhost:5000
Connection: keep-alive
Accept: */*
Access-Control-Request-Method: POST
Access-Control-Request-Headers: content-type
Origin: http://localhost:3000
User-Agent: Mozilla/5.0 (Linux; Android 10; K) AppleWebKit/537.36 (KHTML, like Gecko) Chrome/138.0.0.0 Mobile Safari/537.36
Sec-Fetch-Mode: cors
X-Requested-With: com.duckduckgo.mobile.android
Sec-Fetch-Site: same-site
Sec-Fetch-Dest: empty
Referer: http://localhost:3000/
Accept-Encoding: gzip, deflate, br, zstd
Accept-Language: en-US,en;q=0.9


14:59:24.224451 IP localhost.5000 > localhost.43114: Flags [.], ack 557, win 384, options [nop,nop,TS val 1314682529 ecr 1314682529], length 0
E..4..@.@..............j	p.m.........(.....
N\v.N\v.
14:59:24.230070 IP localhost.5000 > localhost.43108: Flags [P.], seq 1:433, ack 557, win 384, options [nop,nop,TS val 1314682535 ecr 1314682529], length 432
E...m.@.@..,...........d...................
N\v.N\v.HTTP/1.1 200 OK
Server: Werkzeug/2.3.7 Python/3.12.11
Date: Sun, 24 Aug 2025 12:59:24 GMT
Content-Type: text/html; charset=utf-8
Allow: HEAD, GET, OPTIONS, POST
Access-Control-Allow-Origin: http://localhost:3000
Access-Control-Allow-Credentials: true
Access-Control-Allow-Headers: content-type
Access-Control-Allow-Methods: DELETE, GET, HEAD, OPTIONS, PATCH, POST, PUT
Vary: Origin
Content-Length: 0
Connection: close


14:59:24.230113 IP localhost.43108 > localhost.5000: Flags [.], ack 433, win 384, options [nop,nop,TS val 1314682535 ecr 1314682535], length 0
E..4*.@.@............d.........d.....(.....
N\v.N\v.
14:59:24.230562 IP localhost.5000 > localhost.43114: Flags [P.], seq 1:433, ack 557, win 384, options [nop,nop,TS val 1314682535 ecr 1314682529], length 432
E.....@.@..J...........j	p.m...............
N\v.N\v.HTTP/1.1 200 OK
Server: Werkzeug/2.3.7 Python/3.12.11
Date: Sun, 24 Aug 2025 12:59:24 GMT
Content-Type: text/html; charset=utf-8
Allow: HEAD, GET, OPTIONS, POST
Access-Control-Allow-Origin: http://localhost:3000
Access-Control-Allow-Credentials: true
Access-Control-Allow-Headers: content-type
Access-Control-Allow-Methods: DELETE, GET, HEAD, OPTIONS, PATCH, POST, PUT
Vary: Origin
Content-Length: 0
Connection: close


14:59:24.230579 IP localhost.43114 > localhost.5000: Flags [.], ack 433, win 384, options [nop,nop,TS val 1314682535 ecr 1314682535], length 0
E..4Z|@.@..E.........j......	p.......(.....
N\v.N\v.
14:59:24.231314 IP localhost.43108 > localhost.5000: Flags [F.], seq 557, ack 433, win 384, options [nop,nop,TS val 1314682536 ecr 1314682535], length 0
E..4*.@.@............d.........d.....(.....
N\v.N\v.
14:59:24.231810 IP localhost.5000 > localhost.43108: Flags [F.], seq 433, ack 558, win 384, options [nop,nop,TS val 1314682537 ecr 1314682536], length 0
E..4m.@.@..............d...d.........(.....
N\v.N\v.
14:59:24.231887 IP localhost.43108 > localhost.5000: Flags [.], ack 434, win 384, options [nop,nop,TS val 1314682537 ecr 1314682537], length 0
E..4*.@.@............d.........e.....(.....
N\v.N\v.
14:59:24.232908 IP localhost.43114 > localhost.5000: Flags [F.], seq 557, ack 433, win 384, options [nop,nop,TS val 1314682538 ecr 1314682535], length 0
E..4Z}@.@..D.........j......	p.......(.....
N\v.N\v.
14:59:24.233136 IP localhost.5000 > localhost.43114: Flags [F.], seq 433, ack 558, win 384, options [nop,nop,TS val 1314682538 ecr 1314682538], length 0
E..4..@.@..............j	p...........(.....
N\v.N\v.
14:59:24.233174 IP localhost.43114 > localhost.5000: Flags [.], ack 434, win 384, options [nop,nop,TS val 1314682538 ecr 1314682538], length 0
E..4Z~@.@..C.........j......	p.......(.....
N\v.N\v.
14:59:24.239950 IP6 localhost.51568 > localhost.5000: Flags [S], seq 1422636327, win 65535, options [mss 65476,sackOK,TS val 1107446500 ecr 0,nop,wscale 9], length 0
`.J5.(.@.................................p..T..'.........0.........
B.J........	
14:59:24.240008 IP6 localhost.5000 > localhost.51568: Flags [R.], seq 0, ack 1422636328, win 0, length 0
`......@...................................p....T..(P.......
14:59:24.240899 IP localhost.43116 > localhost.5000: Flags [S], seq 991486496, win 65535, options [mss 65495,sackOK,TS val 1314682546 ecr 0,nop,wscale 9], length 0
E..<r.@.@............l..;.. .........0.........
N\v........	
14:59:24.240975 IP localhost.5000 > localhost.43116: Flags [S.], seq 3677528111, ack 991486497, win 65535, options [mss 65495,sackOK,TS val 1314682546 ecr 1314682546,nop,wscale 9], length 0
E..<..@.@.<............l.2./;..!.....0.........
N\v.N\v....	
14:59:24.241024 IP localhost.43116 > localhost.5000: Flags [.], ack 1, win 128, options [nop,nop,TS val 1314682546 ecr 1314682546], length 0
E..4r.@.@............l..;..!.2.0.....(.....
N\v.N\v.
14:59:24.243158 IP6 localhost.51574 > localhost.5000: Flags [S], seq 3628985443, win 65535, options [mss 65476,sackOK,TS val 1107446503 ecr 0,nop,wscale 9], length 0
`.J..(.@.................................v...M.c.........0.........
B.J........	
14:59:24.243201 IP6 localhost.5000 > localhost.51574: Flags [R.], seq 0, ack 3628985444, win 0, length 0
`.?....@...................................v.....M.dP.......
14:59:24.243831 IP localhost.43132 > localhost.5000: Flags [S], seq 3407789321, win 65535, options [mss 65495,sackOK,TS val 1314682549 ecr 0,nop,wscale 9], length 0
E..<.Q@.@.Yh.........|.....	.........0.........
N\v........	
14:59:24.243880 IP localhost.5000 > localhost.43132: Flags [S.], seq 480709927, ack 3407789322, win 65535, options [mss 65495,sackOK,TS val 1314682549 ecr 1314682549,nop,wscale 9], length 0
E..<..@.@.<............|...'...
.....0.........
N\v.N\v....	
14:59:24.243917 IP localhost.43132 > localhost.5000: Flags [.], ack 1, win 128, options [nop,nop,TS val 1314682549 ecr 1314682549], length 0
E..4.R@.@.Yo.........|.....
...(.....(.....
N\v.N\v.
14:59:24.244997 IP localhost.43116 > localhost.5000: Flags [P.], seq 1:792, ack 1, win 128, options [nop,nop,TS val 1314682550 ecr 1314682546], length 791
E..Kr.@.@............l..;..!.2.0.....@.....
N\v.N\v.POST /api/log HTTP/1.1
Host: localhost:5000
Connection: keep-alive
Content-Length: 141
sec-ch-ua-platform: "Android"
User-Agent: Mozilla/5.0 (Linux; Android 10; K) AppleWebKit/537.36 (KHTML, like Gecko) Chrome/138.0.0.0 Mobile Safari/537.36
sec-ch-ua: "Not)A;Brand";v="8", "Chromium";v="138", "DuckDuckGo";v="138"
Content-Type: application/json
sec-ch-ua-mobile: ?1
Accept: */*
Origin: http://localhost:3000
X-Requested-With: com.duckduckgo.mobile.android
Sec-Fetch-Site: same-site
Sec-Fetch-Mode: cors
Sec-Fetch-Dest: empty
Referer: http://localhost:3000/
Accept-Encoding: gzip, deflate, br, zstd
Accept-Language: en-US,en;q=0.9

{"level":"log","message":"[\"CryptoAnalysis - cryptosLoading: false, strategiesLoading: false, configLoading: false, apiIsLoading: false\"]"}
14:59:24.245056 IP localhost.5000 > localhost.43116: Flags [.], ack 792, win 384, options [nop,nop,TS val 1314682550 ecr 1314682550], length 0
E..4;.@.@..8...........l.2.0;..8.....(.....
N\v.N\v.
14:59:24.245500 IP localhost.43132 > localhost.5000: Flags [P.], seq 1:718, ack 1, win 128, options [nop,nop,TS val 1314682550 ecr 1314682549], length 717
E....S@.@.V..........|.....
...(...........
N\v.N\v.POST /api/log HTTP/1.1
Host: localhost:5000
Connection: keep-alive
Content-Length: 68
sec-ch-ua-platform: "Android"
User-Agent: Mozilla/5.0 (Linux; Android 10; K) AppleWebKit/537.36 (KHTML, like Gecko) Chrome/138.0.0.0 Mobile Safari/537.36
sec-ch-ua: "Not)A;Brand";v="8", "Chromium";v="138", "DuckDuckGo";v="138"
Content-Type: application/json
sec-ch-ua-mobile: ?1
Accept: */*
Origin: http://localhost:3000
X-Requested-With: com.duckduckgo.mobile.android
Sec-Fetch-Site: same-site
Sec-Fetch-Mode: cors
Sec-Fetch-Dest: empty
Referer: http://localhost:3000/
Accept-Encoding: gzip, deflate, br, zstd
Accept-Language: en-US,en;q=0.9

{"level":"log","message":"[\"CryptoAnalysis component rendering\"]"}
14:59:24.245554 IP localhost.5000 > localhost.43132: Flags [.], ack 718, win 384, options [nop,nop,TS val 1314682550 ecr 1314682550], length 0
E..4C.@.@..............|...(.........(.....
N\v.N\v.
14:59:24.253318 IP localhost.5000 > localhost.43132: Flags [P.], seq 1:273, ack 718, win 384, options [nop,nop,TS val 1314682558 ecr 1314682550], length 272
E..DC.@.@..............|...(.........8.....
N\v.N\v.HTTP/1.1 200 OK
Server: Werkzeug/2.3.7 Python/3.12.11
Date: Sun, 24 Aug 2025 12:59:24 GMT
Content-Type: application/json
Content-Length: 26
Access-Control-Allow-Origin: http://localhost:3000
Access-Control-Allow-Credentials: true
Vary: Origin
Connection: close


14:59:24.253319 IP localhost.5000 > localhost.43116: Flags [P.], seq 1:273, ack 792, win 384, options [nop,nop,TS val 1314682558 ecr 1314682550], length 272
E..D;.@.@..'...........l.2.0;..8.....8.....
N\v.N\v.HTTP/1.1 200 OK
Server: Werkzeug/2.3.7 Python/3.12.11
Date: Sun, 24 Aug 2025 12:59:24 GMT
Content-Type: application/json
Content-Length: 26
Access-Control-Allow-Origin: http://localhost:3000
Access-Control-Allow-Credentials: true
Vary: Origin
Connection: close


14:59:24.253365 IP localhost.43132 > localhost.5000: Flags [.], ack 273, win 384, options [nop,nop,TS val 1314682558 ecr 1314682558], length 0
E..4.T@.@.Ym.........|.........8.....(.....
N\v.N\v.
14:59:24.253378 IP localhost.43116 > localhost.5000: Flags [.], ack 273, win 384, options [nop,nop,TS val 1314682558 ecr 1314682558], length 0
E..4r.@.@............l..;..8.2.@.....(.....
N\v.N\v.
14:59:24.253414 IP localhost.5000 > localhost.43132: Flags [P.], seq 273:299, ack 718, win 384, options [nop,nop,TS val 1314682558 ecr 1314682558], length 26
E..NC.@.@..............|...8.........B.....
N\v.N\v.{
  "status": "success"
}

14:59:24.253424 IP localhost.43132 > localhost.5000: Flags [.], ack 299, win 384, options [nop,nop,TS val 1314682558 ecr 1314682558], length 0
E..4.U@.@.Yl.........|.........R.....(.....
N\v.N\v.
14:59:24.253507 IP localhost.5000 > localhost.43116: Flags [P.], seq 273:299, ack 792, win 384, options [nop,nop,TS val 1314682558 ecr 1314682558], length 26
E..N;.@.@..............l.2.@;..8.....B.....
N\v.N\v.{
  "status": "success"
}

14:59:24.253541 IP localhost.43116 > localhost.5000: Flags [.], ack 299, win 384, options [nop,nop,TS val 1314682558 ecr 1314682558], length 0
E..4r.@.@............l..;..8.2.Z.....(.....
N\v.N\v.
14:59:24.255742 IP localhost.43132 > localhost.5000: Flags [F.], seq 718, ack 299, win 384, options [nop,nop,TS val 1314682560 ecr 1314682558], length 0
E..4.V@.@.Yk.........|.........R.....(.....
N\v.N\v.
14:59:24.256466 IP localhost.5000 > localhost.43132: Flags [F.], seq 299, ack 719, win 384, options [nop,nop,TS val 1314682561 ecr 1314682560], length 0
E..4C.@.@..............|...R.........(.....
N\v.N\v.
14:59:24.256522 IP localhost.43132 > localhost.5000: Flags [.], ack 300, win 384, options [nop,nop,TS val 1314682561 ecr 1314682561], length 0
E..4.W@.@.Yj.........|.........S.....(.....
N\v.N\v.
14:59:24.256636 IP localhost.43116 > localhost.5000: Flags [F.], seq 792, ack 299, win 384, options [nop,nop,TS val 1314682561 ecr 1314682558], length 0
E..4r.@.@............l..;..8.2.Z.....(.....
N\v.N\v.
14:59:24.257484 IP localhost.5000 > localhost.43116: Flags [F.], seq 299, ack 793, win 384, options [nop,nop,TS val 1314682562 ecr 1314682561], length 0
E..4;.@.@..5...........l.2.Z;..9.....(.....
N\v.N\v.
14:59:24.257515 IP localhost.43116 > localhost.5000: Flags [.], ack 300, win 384, options [nop,nop,TS val 1314682562 ecr 1314682562], length 0
E..4r.@.@............l..;..9.2.[.....(.....
N\v.N\v.
14:59:24.259000 IP6 localhost.51588 > localhost.5000: Flags [S], seq 917440799, win 65535, options [mss 65476,sackOK,TS val 1107446519 ecr 0,nop,wscale 9], length 0
`.]..(.@....................................6.	..........0.........
B.J........	
14:59:24.259052 IP6 localhost.5000 > localhost.51588: Flags [R.], seq 0, ack 917440800, win 0, length 0
`......@........................................6.	 P.......
14:59:24.259973 IP localhost.43144 > localhost.5000: Flags [S], seq 1000404751, win 65535, options [mss 65495,sackOK,TS val 1314682565 ecr 0,nop,wscale 9], length 0
E..<|.@.@...............;............0.........
N\v........	
14:59:24.260054 IP localhost.5000 > localhost.43144: Flags [S.], seq 915167167, ack 1000404752, win 65535, options [mss 65495,sackOK,TS val 1314682565 ecr 1314682565,nop,wscale 9], length 0
E..<..@.@.<.............6.W.;........0.........
N\v.N\v....	
14:59:24.260113 IP localhost.43144 > localhost.5000: Flags [.], ack 1, win 128, options [nop,nop,TS val 1314682565 ecr 1314682565], length 0
E..4|.@.@...............;...6.W......(.....
N\v.N\v.
14:59:24.263682 IP6 localhost.51604 > localhost.5000: Flags [S], seq 3369508766, win 65535, options [mss 65476,sackOK,TS val 1107446523 ecr 0,nop,wscale 9], length 0
`....(.@.................................................0.........
B.J........	
14:59:24.263704 IP6 localhost.5000 > localhost.51604: Flags [R.], seq 0, ack 3369508767, win 0, length 0
`.Ry...@............................................P.......
14:59:24.264313 IP localhost.43148 > localhost.5000: Flags [S], seq 3802656553, win 65535, options [mss 65495,sackOK,TS val 1314682569 ecr 0,nop,wscale 9], length 0
E..<.#@.@..................).........0.........
N\v........	
14:59:24.264347 IP localhost.5000 > localhost.43148: Flags [S.], seq 1959171389, ack 3802656554, win 65535, options [mss 65495,sackOK,TS val 1314682569 ecr 1314682569,nop,wscale 9], length 0
E..<..@.@.<.............t..=...*.....0.........
N\v.N\v....	
14:59:24.264368 IP localhost.43148 > localhost.5000: Flags [.], ack 1, win 128, options [nop,nop,TS val 1314682569 ecr 1314682569], length 0
E..4.$@.@..................*t..>.....(.....
N\v.N\v.
14:59:24.266308 IP localhost.43144 > localhost.5000: Flags [P.], seq 1:789, ack 1, win 128, options [nop,nop,TS val 1314682571 ecr 1314682565], length 788
E..H| @.@...............;...6.W......=.....
N\v.N\v.POST /api/log HTTP/1.1
Host: localhost:5000
Connection: keep-alive
Content-Length: 138
sec-ch-ua-platform: "Android"
User-Agent: Mozilla/5.0 (Linux; Android 10; K) AppleWebKit/537.36 (KHTML, like Gecko) Chrome/138.0.0.0 Mobile Safari/537.36
sec-ch-ua: "Not)A;Brand";v="8", "Chromium";v="138", "DuckDuckGo";v="138"
Content-Type: application/json
sec-ch-ua-mobile: ?1
Accept: */*
Origin: http://localhost:3000
X-Requested-With: com.duckduckgo.mobile.android
Sec-Fetch-Site: same-site
Sec-Fetch-Mode: cors
Sec-Fetch-Dest: empty
Referer: http://localhost:3000/
Accept-Encoding: gzip, deflate, br, zstd
Accept-Language: en-US,en;q=0.9

{"level":"log","message":"[\"CryptoAnalysis - cryptosLoading: true, strategiesLoading: true, configLoading: true, apiIsLoading: false\"]"}
14:59:24.266418 IP localhost.5000 > localhost.43144: Flags [.], ack 789, win 384, options [nop,nop,TS val 1314682571 ecr 1314682571], length 0
E..4B.@.@...............6.W.;..$.....(.....
N\v.N\v.
14:59:24.266889 IP localhost.43148 > localhost.5000: Flags [P.], seq 1:718, ack 1, win 128, options [nop,nop,TS val 1314682572 ecr 1314682569], length 717
E....%@.@..................*t..>...........
N\v.N\v.POST /api/log HTTP/1.1
Host: localhost:5000
Connection: keep-alive
Content-Length: 68
sec-ch-ua-platform: "Android"
User-Agent: Mozilla/5.0 (Linux; Android 10; K) AppleWebKit/537.36 (KHTML, like Gecko) Chrome/138.0.0.0 Mobile Safari/537.36
sec-ch-ua: "Not)A;Brand";v="8", "Chromium";v="138", "DuckDuckGo";v="138"
Content-Type: application/json
sec-ch-ua-mobile: ?1
Accept: */*
Origin: http://localhost:3000
X-Requested-With: com.duckduckgo.mobile.android
Sec-Fetch-Site: same-site
Sec-Fetch-Mode: cors
Sec-Fetch-Dest: empty
Referer: http://localhost:3000/
Accept-Encoding: gzip, deflate, br, zstd
Accept-Language: en-US,en;q=0.9

{"level":"log","message":"[\"CryptoAnalysis component rendering\"]"}
14:59:24.266946 IP localhost.5000 > localhost.43148: Flags [.], ack 718, win 384, options [nop,nop,TS val 1314682572 ecr 1314682572], length 0
E..41.@.@.
.............t..>.........(.....
N\v.N\v.
14:59:24.273959 IP6 localhost.51614 > localhost.5000: Flags [S], seq 2376990170, win 65535, options [mss 65476,sackOK,TS val 1107446534 ecr 0,nop,wscale 9], length 0
`....(.@.................................................0.........
B.K........	
14:59:24.274025 IP6 localhost.5000 > localhost.51614: Flags [R.], seq 0, ack 2376990171, win 0, length 0
`.Q....@............................................P.......
14:59:24.275192 IP localhost.43164 > localhost.5000: Flags [S], seq 1171406551, win 65535, options [mss 65495,sackOK,TS val 1314682580 ecr 0,nop,wscale 9], length 0
E..<..@.@...............E.>..........0.........
N\v........	
14:59:24.275292 IP localhost.5000 > localhost.43164: Flags [S.], seq 3528119679, ack 1171406552, win 65535, options [mss 65495,sackOK,TS val 1314682580 ecr 1314682580,nop,wscale 9], length 0
E..<..@.@.<..............J..E.>......0.........
N\v.N\v....	
14:59:24.275350 IP localhost.43164 > localhost.5000: Flags [.], ack 1, win 128, options [nop,nop,TS val 1314682580 ecr 1314682580], length 0
E..4..@.@...............E.>..J.......(.....
N\v.N\v.
14:59:24.279380 IP localhost.5000 > localhost.43148: Flags [P.], seq 1:273, ack 718, win 384, options [nop,nop,TS val 1314682584 ecr 1314682572], length 272
E..D1.@.@.	.............t..>.........8.....
N\v.N\v.HTTP/1.1 200 OK
Server: Werkzeug/2.3.7 Python/3.12.11
Date: Sun, 24 Aug 2025 12:59:24 GMT
Content-Type: application/json
Content-Length: 26
Access-Control-Allow-Origin: http://localhost:3000
Access-Control-Allow-Credentials: true
Vary: Origin
Connection: close


14:59:24.279420 IP localhost.43148 > localhost.5000: Flags [.], ack 273, win 384, options [nop,nop,TS val 1314682584 ecr 1314682584], length 0
E..4.&@.@...................t..N.....(.....
N\v.N\v.
14:59:24.279589 IP6 localhost.51628 > localhost.5000: Flags [S], seq 1981969767, win 65535, options [mss 65476,sackOK,TS val 1107446539 ecr 0,nop,wscale 9], length 0
`....(.@....................................v"ug.........0.........
B.K........	
14:59:24.279654 IP6 localhost.5000 > localhost.51628: Flags [R.], seq 0, ack 1981969768, win 0, length 0
`.w....@........................................v"uhP.......
14:59:24.279685 IP localhost.5000 > localhost.43148: Flags [P.], seq 273:299, ack 718, win 384, options [nop,nop,TS val 1314682584 ecr 1314682584], length 26
E..N1.@.@.
.............t..N.........B.....
N\v.N\v.{
  "status": "success"
}

14:59:24.279700 IP localhost.43148 > localhost.5000: Flags [.], ack 299, win 384, options [nop,nop,TS val 1314682584 ecr 1314682584], length 0
E..4.'@.@...................t..h.....(.....
N\v.N\v.
14:59:24.280783 IP localhost.43174 > localhost.5000: Flags [S], seq 1676446060, win 65535, options [mss 65495,sackOK,TS val 1314682585 ecr 0,nop,wscale 9], length 0
E..<|.@.@..9............c..l.........0.........
N\v........	
14:59:24.280853 IP localhost.5000 > localhost.43174: Flags [S.], seq 14584628, ack 1676446061, win 65535, options [mss 65495,sackOK,TS val 1314682586 ecr 1314682585,nop,wscale 9], length 0
E..<..@.@.<................4c..m.....0.........
N\v.N\v....	
14:59:24.280904 IP localhost.43174 > localhost.5000: Flags [.], ack 1, win 128, options [nop,nop,TS val 1314682586 ecr 1314682586], length 0
E..4|.@.@..@............c..m...5.....(.....
N\v.N\v.
14:59:24.281071 IP localhost.5000 > localhost.43144: Flags [P.], seq 1:273, ack 789, win 384, options [nop,nop,TS val 1314682586 ecr 1314682571], length 272
E..DB.@.@...............6.W.;..$.....8.....
N\v.N\v.HTTP/1.1 200 OK
Server: Werkzeug/2.3.7 Python/3.12.11
Date: Sun, 24 Aug 2025 12:59:24 GMT
Content-Type: application/json
Content-Length: 26
Access-Control-Allow-Origin: http://localhost:3000
Access-Control-Allow-Credentials: true
Vary: Origin
Connection: close


14:59:24.281092 IP localhost.43144 > localhost.5000: Flags [.], ack 273, win 384, options [nop,nop,TS val 1314682586 ecr 1314682586], length 0
E..4|!@.@...............;..$6.X......(.....
N\v.N\v.
14:59:24.281127 IP localhost.5000 > localhost.43144: Flags [P.], seq 273:299, ack 789, win 384, options [nop,nop,TS val 1314682586 ecr 1314682586], length 26
E..NB.@.@...............6.X.;..$.....B.....
N\v.N\v.{
  "status": "success"
}

14:59:24.281136 IP localhost.43144 > localhost.5000: Flags [.], ack 299, win 384, options [nop,nop,TS val 1314682586 ecr 1314682586], length 0
E..4|"@.@...............;..$6.X......(.....
N\v.N\v.
14:59:24.284331 IP localhost.43148 > localhost.5000: Flags [F.], seq 718, ack 299, win 384, options [nop,nop,TS val 1314682589 ecr 1314682584], length 0
E..4.(@.@...................t..h.....(.....
N\v.N\v.
14:59:24.284722 IP localhost.5000 > localhost.43148: Flags [F.], seq 299, ack 719, win 384, options [nop,nop,TS val 1314682589 ecr 1314682589], length 0
E..41.@.@.
.............t..h.........(.....
N\v.N\v.
14:59:24.284768 IP localhost.43148 > localhost.5000: Flags [.], ack 300, win 384, options [nop,nop,TS val 1314682590 ecr 1314682589], length 0
E..4.)@.@...................t..i.....(.....
N\v.N\v.
14:59:24.285042 IP localhost.43144 > localhost.5000: Flags [F.], seq 789, ack 299, win 384, options [nop,nop,TS val 1314682590 ecr 1314682586], length 0
E..4|#@.@...............;..$6.X......(.....
N\v.N\v.
14:59:24.285416 IP localhost.5000 > localhost.43144: Flags [F.], seq 299, ack 790, win 384, options [nop,nop,TS val 1314682590 ecr 1314682590], length 0
E..4B.@.@...............6.X.;..%.....(.....
N\v.N\v.
14:59:24.285481 IP localhost.43144 > localhost.5000: Flags [.], ack 300, win 384, options [nop,nop,TS val 1314682590 ecr 1314682590], length 0
E..4|$@.@...............;..%6.X......(.....
N\v.N\v.
14:59:24.286126 IP localhost.43164 > localhost.5000: Flags [P.], seq 1:789, ack 1, win 128, options [nop,nop,TS val 1314682591 ecr 1314682580], length 788
E..H..@.@...............E.>..J.......=.....
N\v.N\v.POST /api/log HTTP/1.1
Host: localhost:5000
Connection: keep-alive
Content-Length: 138
sec-ch-ua-platform: "Android"
User-Agent: Mozilla/5.0 (Linux; Android 10; K) AppleWebKit/537.36 (KHTML, like Gecko) Chrome/138.0.0.0 Mobile Safari/537.36
sec-ch-ua: "Not)A;Brand";v="8", "Chromium";v="138", "DuckDuckGo";v="138"
Content-Type: application/json
sec-ch-ua-mobile: ?1
Accept: */*
Origin: http://localhost:3000
X-Requested-With: com.duckduckgo.mobile.android
Sec-Fetch-Site: same-site
Sec-Fetch-Mode: cors
Sec-Fetch-Dest: empty
Referer: http://localhost:3000/
Accept-Encoding: gzip, deflate, br, zstd
Accept-Language: en-US,en;q=0.9

{"level":"log","message":"[\"CryptoAnalysis - cryptosLoading: true, strategiesLoading: true, configLoading: true, apiIsLoading: false\"]"}
14:59:24.286174 IP localhost.5000 > localhost.43164: Flags [.], ack 789, win 384, options [nop,nop,TS val 1314682591 ecr 1314682591], length 0
E..4..@.@.h..............J..E.A......(.....
N\v.N\v.
14:59:24.286997 IP localhost.43174 > localhost.5000: Flags [P.], seq 1:718, ack 1, win 128, options [nop,nop,TS val 1314682592 ecr 1314682586], length 717
E...|.@.@..r............c..m...5...........
N\v.N\v.POST /api/log HTTP/1.1
Host: localhost:5000
Connection: keep-alive
Content-Length: 68
sec-ch-ua-platform: "Android"
User-Agent: Mozilla/5.0 (Linux; Android 10; K) AppleWebKit/537.36 (KHTML, like Gecko) Chrome/138.0.0.0 Mobile Safari/537.36
sec-ch-ua: "Not)A;Brand";v="8", "Chromium";v="138", "DuckDuckGo";v="138"
Content-Type: application/json
sec-ch-ua-mobile: ?1
Accept: */*
Origin: http://localhost:3000
X-Requested-With: com.duckduckgo.mobile.android
Sec-Fetch-Site: same-site
Sec-Fetch-Mode: cors
Sec-Fetch-Dest: empty
Referer: http://localhost:3000/
Accept-Encoding: gzip, deflate, br, zstd
Accept-Language: en-US,en;q=0.9

{"level":"log","message":"[\"CryptoAnalysis component rendering\"]"}
14:59:24.287042 IP localhost.5000 > localhost.43174: Flags [.], ack 718, win 384, options [nop,nop,TS val 1314682592 ecr 1314682592], length 0
E..4..@.@.T................5c..:.....(.....
N\v.N\v.
14:59:24.290064 IP localhost.5000 > localhost.43164: Flags [P.], seq 1:273, ack 789, win 384, options [nop,nop,TS val 1314682595 ecr 1314682591], length 272
E..D..@.@.g..............J..E.A......8.....
N\v.N\v.HTTP/1.1 200 OK
Server: Werkzeug/2.3.7 Python/3.12.11
Date: Sun, 24 Aug 2025 12:59:24 GMT
Content-Type: application/json
Content-Length: 26
Access-Control-Allow-Origin: http://localhost:3000
Access-Control-Allow-Credentials: true
Vary: Origin
Connection: close


14:59:24.290101 IP localhost.43164 > localhost.5000: Flags [.], ack 273, win 384, options [nop,nop,TS val 1314682595 ecr 1314682595], length 0
E..4..@.@...............E.A..J.......(.....
N\v.N\v.
14:59:24.290144 IP localhost.5000 > localhost.43174: Flags [P.], seq 1:273, ack 718, win 384, options [nop,nop,TS val 1314682595 ecr 1314682592], length 272
E..D..@.@.S................5c..:.....8.....
N\v.N\v.HTTP/1.1 200 OK
Server: Werkzeug/2.3.7 Python/3.12.11
Date: Sun, 24 Aug 2025 12:59:24 GMT
Content-Type: application/json
Content-Length: 26
Access-Control-Allow-Origin: http://localhost:3000
Access-Control-Allow-Credentials: true
Vary: Origin
Connection: close


14:59:24.290145 IP localhost.5000 > localhost.43164: Flags [P.], seq 273:299, ack 789, win 384, options [nop,nop,TS val 1314682595 ecr 1314682595], length 26
E..N..@.@.h..............J..E.A......B.....
N\v.N\v.{
  "status": "success"
}

14:59:24.290153 IP localhost.43164 > localhost.5000: Flags [.], ack 299, win 384, options [nop,nop,TS val 1314682595 ecr 1314682595], length 0
E..4..@.@...............E.A..J.......(.....
N\v.N\v.
14:59:24.290161 IP localhost.43174 > localhost.5000: Flags [.], ack 273, win 384, options [nop,nop,TS val 1314682595 ecr 1314682595], length 0
E..4|.@.@..>............c..:...E.....(.....
N\v.N\v.
14:59:24.290238 IP localhost.5000 > localhost.43174: Flags [P.], seq 273:299, ack 718, win 384, options [nop,nop,TS val 1314682595 ecr 1314682595], length 26
E..N..@.@.T................Ec..:.....B.....
N\v.N\v.{
  "status": "success"
}

14:59:24.290247 IP localhost.43174 > localhost.5000: Flags [.], ack 299, win 384, options [nop,nop,TS val 1314682595 ecr 1314682595], length 0
E..4|.@.@..=............c..:..._.....(.....
N\v.N\v.
14:59:24.291507 IP localhost.43164 > localhost.5000: Flags [F.], seq 789, ack 299, win 384, options [nop,nop,TS val 1314682596 ecr 1314682595], length 0
E..4..@.@...............E.A..J.......(.....
N\v.N\v.
14:59:24.291789 IP localhost.5000 > localhost.43164: Flags [F.], seq 299, ack 790, win 384, options [nop,nop,TS val 1314682596 ecr 1314682596], length 0
E..4..@.@.h..............J..E.A......(.....
N\v.N\v.
14:59:24.291826 IP localhost.43164 > localhost.5000: Flags [.], ack 300, win 384, options [nop,nop,TS val 1314682597 ecr 1314682596], length 0
E..4..@.@...............E.A..J.......(.....
N\v.N\v.
14:59:24.292158 IP localhost.43174 > localhost.5000: Flags [F.], seq 718, ack 299, win 384, options [nop,nop,TS val 1314682597 ecr 1314682595], length 0
E..4|.@.@..<............c..:..._.....(.....
N\v.N\v.
14:59:24.292487 IP localhost.5000 > localhost.43174: Flags [F.], seq 299, ack 719, win 384, options [nop,nop,TS val 1314682597 ecr 1314682597], length 0
E..4..@.@.T................_c..;.....(.....
N\v.N\v.
14:59:24.292514 IP localhost.43174 > localhost.5000: Flags [.], ack 300, win 384, options [nop,nop,TS val 1314682597 ecr 1314682597], length 0
E..4|.@.@..;............c..;...`.....(.....
N\v.N\v.
14:59:25.282601 IP6 localhost.51644 > localhost.5000: Flags [S], seq 453702166, win 65535, options [mss 65476,sackOK,TS val 1107447542 ecr 0,nop,wscale 9], length 0
`.*..(.@.....................................
...........0.........
B.N........	
14:59:25.282669 IP6 localhost.5000 > localhost.51644: Flags [R.], seq 0, ack 453702167, win 0, length 0
`..>...@.........................................
..P.......
14:59:25.283592 IP localhost.43184 > localhost.5000: Flags [S], seq 2963748249, win 65535, options [mss 65495,sackOK,TS val 1314683588 ecr 0,nop,wscale 9], length 0
E..<.q@.@.|H..............5..........0.........
N\z........	
14:59:25.283680 IP localhost.5000 > localhost.43184: Flags [S.], seq 1577050357, ack 2963748250, win 65535, options [mss 65495,sackOK,TS val 1314683588 ecr 1314683588,nop,wscale 9], length 0
E..<..@.@.<.............].....5......0.........
N\z.N\z....	
14:59:25.283737 IP localhost.43184 > localhost.5000: Flags [.], ack 1, win 128, options [nop,nop,TS val 1314683589 ecr 1314683588], length 0
E..4.r@.@.|O..............5.]........(.....
N\z.N\z.
14:59:25.284732 IP localhost.43184 > localhost.5000: Flags [P.], seq 1:718, ack 1, win 128, options [nop,nop,TS val 1314683589 ecr 1314683588], length 717
E....s@.@.y...............5.]..............
N\z.N\z.POST /api/log HTTP/1.1
Host: localhost:5000
Connection: keep-alive
Content-Length: 68
sec-ch-ua-platform: "Android"
User-Agent: Mozilla/5.0 (Linux; Android 10; K) AppleWebKit/537.36 (KHTML, like Gecko) Chrome/138.0.0.0 Mobile Safari/537.36
sec-ch-ua: "Not)A;Brand";v="8", "Chromium";v="138", "DuckDuckGo";v="138"
Content-Type: application/json
sec-ch-ua-mobile: ?1
Accept: */*
Origin: http://localhost:3000
X-Requested-With: com.duckduckgo.mobile.android
Sec-Fetch-Site: same-site
Sec-Fetch-Mode: cors
Sec-Fetch-Dest: empty
Referer: http://localhost:3000/
Accept-Encoding: gzip, deflate, br, zstd
Accept-Language: en-US,en;q=0.9

{"level":"log","message":"[\"CryptoAnalysis component rendering\"]"}
14:59:25.284757 IP localhost.5000 > localhost.43184: Flags [.], ack 718, win 384, options [nop,nop,TS val 1314683590 ecr 1314683589], length 0
E..4.#@.@._.............].....8g.....(.....
N\z.N\z.
14:59:25.285550 IP6 localhost.51656 > localhost.5000: Flags [S], seq 1752862955, win 65535, options [mss 65476,sackOK,TS val 1107447545 ecr 0,nop,wscale 9], length 0
`.W..(.@....................................hz...........0.........
B.N........	
14:59:25.285573 IP6 localhost.5000 > localhost.51656: Flags [R.], seq 0, ack 1752862956, win 0, length 0
`.m}...@........................................hz..P.......
14:59:25.286087 IP localhost.43198 > localhost.5000: Flags [S], seq 1125208025, win 65535, options [mss 65495,sackOK,TS val 1314683591 ecr 0,nop,wscale 9], length 0
E..<.S@.@.+g............C.O..........0.........
N\z........	
14:59:25.286112 IP localhost.5000 > localhost.43198: Flags [S.], seq 1984329411, ack 1125208026, win 65535, options [mss 65495,sackOK,TS val 1314683591 ecr 1314683591,nop,wscale 9], length 0
E..<..@.@.<.............vFv.C.O......0.........
N\z.N\z....	
14:59:25.286130 IP localhost.43198 > localhost.5000: Flags [.], ack 1, win 128, options [nop,nop,TS val 1314683591 ecr 1314683591], length 0
E..4.T@.@.+n............C.O.vFv......(.....
N\z.N\z.
14:59:25.286618 IP localhost.43198 > localhost.5000: Flags [P.], seq 1:789, ack 1, win 128, options [nop,nop,TS val 1314683591 ecr 1314683591], length 788
E..H.U@.@.(Y............C.O.vFv......=.....
N\z.N\z.POST /api/log HTTP/1.1
Host: localhost:5000
Connection: keep-alive
Content-Length: 138
sec-ch-ua-platform: "Android"
User-Agent: Mozilla/5.0 (Linux; Android 10; K) AppleWebKit/537.36 (KHTML, like Gecko) Chrome/138.0.0.0 Mobile Safari/537.36
sec-ch-ua: "Not)A;Brand";v="8", "Chromium";v="138", "DuckDuckGo";v="138"
Content-Type: application/json
sec-ch-ua-mobile: ?1
Accept: */*
Origin: http://localhost:3000
X-Requested-With: com.duckduckgo.mobile.android
Sec-Fetch-Site: same-site
Sec-Fetch-Mode: cors
Sec-Fetch-Dest: empty
Referer: http://localhost:3000/
Accept-Encoding: gzip, deflate, br, zstd
Accept-Language: en-US,en;q=0.9

{"level":"log","message":"[\"CryptoAnalysis - cryptosLoading: true, strategiesLoading: true, configLoading: true, apiIsLoading: false\"]"}
14:59:25.286638 IP localhost.5000 > localhost.43198: Flags [.], ack 789, win 384, options [nop,nop,TS val 1314683591 ecr 1314683591], length 0
E..4$m@.@..U............vFv.C.R......(.....
N\z.N\z.
14:59:25.292289 IP localhost.5000 > localhost.43184: Flags [P.], seq 1:273, ack 718, win 384, options [nop,nop,TS val 1314683597 ecr 1314683589], length 272
E..D.$@.@.^.............].....8g.....8.....
N\z.N\z.HTTP/1.1 200 OK
Server: Werkzeug/2.3.7 Python/3.12.11
Date: Sun, 24 Aug 2025 12:59:25 GMT
Content-Type: application/json
Content-Length: 26
Access-Control-Allow-Origin: http://localhost:3000
Access-Control-Allow-Credentials: true
Vary: Origin
Connection: close


14:59:25.292341 IP localhost.43184 > localhost.5000: Flags [.], ack 273, win 384, options [nop,nop,TS val 1314683597 ecr 1314683597], length 0
E..4.t@.@.|M..............8g]........(.....
N\z.N\z.
14:59:25.295986 IP localhost.5000 > localhost.43184: Flags [P.], seq 273:299, ack 718, win 384, options [nop,nop,TS val 1314683601 ecr 1314683597], length 26
E..N.%@.@._.............].....8g.....B.....
N\z.N\z.{
  "status": "success"
}

14:59:25.296032 IP localhost.43184 > localhost.5000: Flags [.], ack 299, win 384, options [nop,nop,TS val 1314683601 ecr 1314683601], length 0
E..4.u@.@.|L..............8g].. .....(.....
N\z.N\z.
14:59:25.296225 IP localhost.43184 > localhost.5000: Flags [F.], seq 718, ack 299, win 384, options [nop,nop,TS val 1314683601 ecr 1314683601], length 0
E..4.v@.@.|K..............8g].. .....(.....
N\z.N\z.
14:59:25.298877 IP localhost.5000 > localhost.43184: Flags [F.], seq 299, ack 719, win 384, options [nop,nop,TS val 1314683604 ecr 1314683601], length 0
E..4.&@.@._.............].. ..8h.....(.....
N\z.N\z.
14:59:25.298952 IP localhost.43184 > localhost.5000: Flags [.], ack 300, win 384, options [nop,nop,TS val 1314683604 ecr 1314683604], length 0
E..4.w@.@.|J..............8h]..!.....(.....
N\z.N\z.
14:59:25.299207 IP localhost.5000 > localhost.43198: Flags [P.], seq 1:273, ack 789, win 384, options [nop,nop,TS val 1314683604 ecr 1314683591], length 272
E..D$n@.@..D............vFv.C.R......8.....
N\z.N\z.HTTP/1.1 200 OK
Server: Werkzeug/2.3.7 Python/3.12.11
Date: Sun, 24 Aug 2025 12:59:25 GMT
Content-Type: application/json
Content-Length: 26
Access-Control-Allow-Origin: http://localhost:3000
Access-Control-Allow-Credentials: true
Vary: Origin
Connection: close


14:59:25.299242 IP localhost.43198 > localhost.5000: Flags [.], ack 273, win 384, options [nop,nop,TS val 1314683604 ecr 1314683604], length 0
E..4.V@.@.+l............C.R.vFw......(.....
N\z.N\z.
14:59:25.299291 IP localhost.5000 > localhost.43198: Flags [P.], seq 273:299, ack 789, win 384, options [nop,nop,TS val 1314683604 ecr 1314683604], length 26
E..N$o@.@..9............vFw.C.R......B.....
N\z.N\z.{
  "status": "success"
}

14:59:25.299305 IP localhost.43198 > localhost.5000: Flags [.], ack 299, win 384, options [nop,nop,TS val 1314683604 ecr 1314683604], length 0
E..4.W@.@.+k............C.R.vFw......(.....
N\z.N\z.
14:59:25.300702 IP localhost.43198 > localhost.5000: Flags [F.], seq 789, ack 299, win 384, options [nop,nop,TS val 1314683605 ecr 1314683604], length 0
E..4.X@.@.+j............C.R.vFw......(.....
N\z.N\z.
14:59:25.300973 IP localhost.5000 > localhost.43198: Flags [F.], seq 299, ack 790, win 384, options [nop,nop,TS val 1314683606 ecr 1314683605], length 0
E..4$p@.@..R............vFw.C.R......(.....
N\z.N\z.
14:59:25.301020 IP localhost.43198 > localhost.5000: Flags [.], ack 300, win 384, options [nop,nop,TS val 1314683606 ecr 1314683606], length 0
E..4.Y@.@.+i............C.R.vFw......(.....
N\z.N\z.
14:59:27.284049 IP6 localhost.54928 > localhost.5000: Flags [S], seq 3166517043, win 65535, options [mss 65476,sackOK,TS val 1107449544 ecr 0,nop,wscale 9], length 0
`	...(.@......................................73.........0.........
B.V........	
14:59:27.284088 IP6 localhost.5000 > localhost.54928: Flags [R.], seq 0, ack 3166517044, win 0, length 0
`	.....@..........................................74P.......
14:59:27.284933 IP localhost.39020 > localhost.5000: Flags [S], seq 1818615397, win 65535, options [mss 65495,sackOK,TS val 1314685590 ecr 0,nop,wscale 9], length 0
E..<7N@.@..l.........l..le.e.........0.........
N\.........	
14:59:27.284990 IP localhost.5000 > localhost.39020: Flags [S.], seq 2049560626, ack 1818615398, win 65535, options [mss 65495,sackOK,TS val 1314685590 ecr 1314685590,nop,wscale 9], length 0
E..<..@.@.<............lz).2le.f.....0.........
N\..N\.....	
14:59:27.285026 IP localhost.39020 > localhost.5000: Flags [.], ack 1, win 128, options [nop,nop,TS val 1314685590 ecr 1314685590], length 0
E..47O@.@..s.........l..le.fz).3.....(.....
N\..N\..
14:59:27.287989 IP localhost.39020 > localhost.5000: Flags [P.], seq 1:789, ack 1, win 128, options [nop,nop,TS val 1314685593 ecr 1314685590], length 788
E..H7P@.@..^.........l..le.fz).3.....=.....
N\..N\..POST /api/log HTTP/1.1
Host: localhost:5000
Connection: keep-alive
Content-Length: 138
sec-ch-ua-platform: "Android"
User-Agent: Mozilla/5.0 (Linux; Android 10; K) AppleWebKit/537.36 (KHTML, like Gecko) Chrome/138.0.0.0 Mobile Safari/537.36
sec-ch-ua: "Not)A;Brand";v="8", "Chromium";v="138", "DuckDuckGo";v="138"
Content-Type: application/json
sec-ch-ua-mobile: ?1
Accept: */*
Origin: http://localhost:3000
X-Requested-With: com.duckduckgo.mobile.android
Sec-Fetch-Site: same-site
Sec-Fetch-Mode: cors
Sec-Fetch-Dest: empty
Referer: http://localhost:3000/
Accept-Encoding: gzip, deflate, br, zstd
Accept-Language: en-US,en;q=0.9

{"level":"log","message":"[\"CryptoAnalysis - cryptosLoading: true, strategiesLoading: true, configLoading: true, apiIsLoading: false\"]"}
14:59:27.288215 IP localhost.5000 > localhost.39020: Flags [.], ack 789, win 384, options [nop,nop,TS val 1314685593 ecr 1314685593], length 0
E..4>a@.@..`...........lz).3le.z.....(.....
N\..N\..
14:59:27.293112 IP localhost.5000 > localhost.39020: Flags [P.], seq 1:273, ack 789, win 384, options [nop,nop,TS val 1314685598 ecr 1314685593], length 272
E..D>b@.@..O...........lz).3le.z.....8.....
N\..N\..HTTP/1.1 200 OK
Server: Werkzeug/2.3.7 Python/3.12.11
Date: Sun, 24 Aug 2025 12:59:27 GMT
Content-Type: application/json
Content-Length: 26
Access-Control-Allow-Origin: http://localhost:3000
Access-Control-Allow-Credentials: true
Vary: Origin
Connection: close


14:59:27.293157 IP localhost.39020 > localhost.5000: Flags [.], ack 273, win 384, options [nop,nop,TS val 1314685598 ecr 1314685598], length 0
E..47Q@.@..q.........l..le.zz).C.....(.....
N\..N\..
14:59:27.293205 IP localhost.5000 > localhost.39020: Flags [P.], seq 273:299, ack 789, win 384, options [nop,nop,TS val 1314685598 ecr 1314685598], length 26
E..N>c@.@..D...........lz).Cle.z.....B.....
N\..N\..{
  "status": "success"
}

14:59:27.293215 IP localhost.39020 > localhost.5000: Flags [.], ack 299, win 384, options [nop,nop,TS val 1314685598 ecr 1314685598], length 0
E..47R@.@..p.........l..le.zz).].....(.....
N\..N\..
14:59:27.294765 IP6 localhost.54940 > localhost.5000: Flags [S], seq 1806928616, win 65535, options [mss 65476,sackOK,TS val 1107449554 ecr 0,nop,wscale 9], length 0
`....(.@....................................k............0.........
B.V........	
14:59:27.294839 IP6 localhost.5000 > localhost.54940: Flags [R.], seq 0, ack 1806928617, win 0, length 0
`......@........................................k...P.......
14:59:27.295743 IP localhost.39034 > localhost.5000: Flags [S], seq 4107764684, win 65535, options [mss 65495,sackOK,TS val 1314685600 ecr 0,nop,wscale 9], length 0
E..<{X@.@..a.........z...............0.........
N\.........	
14:59:27.295826 IP localhost.5000 > localhost.39034: Flags [S.], seq 41637493, ack 4107764685, win 65535, options [mss 65495,sackOK,TS val 1314685601 ecr 1314685600,nop,wscale 9], length 0
E..<..@.@.<............z.{Vu.........0.........
N\..N\.....	
14:59:27.295887 IP localhost.39034 > localhost.5000: Flags [.], ack 1, win 128, options [nop,nop,TS val 1314685601 ecr 1314685601], length 0
E..4{Y@.@..h.........z.......{Vv.....(.....
N\..N\..
14:59:27.298956 IP6 localhost.54946 > localhost.5000: Flags [S], seq 98353508, win 65535, options [mss 65476,sackOK,TS val 1107449559 ecr 0,nop,wscale 9], length 0
`
...(.@.......................................d.........0.........
B.V........	
14:59:27.298982 IP6 localhost.5000 > localhost.54946: Flags [R.], seq 0, ack 98353509, win 0, length 0
`.h....@...........................................eP.......
14:59:27.299447 IP localhost.39048 > localhost.5000: Flags [S], seq 2652802759, win 65535, options [mss 65495,sackOK,TS val 1314685604 ecr 0,nop,wscale 9], length 0
E..<..@.@.\!.........................0.........
N\.........	
14:59:27.299480 IP localhost.5000 > localhost.39048: Flags [S.], seq 2000061024, ack 2652802760, win 65535, options [mss 65495,sackOK,TS val 1314685604 ecr 1314685604,nop,wscale 9], length 0
E..<..@.@.<.............w6.`.........0.........
N\..N\.....	
14:59:27.299501 IP localhost.39048 > localhost.5000: Flags [.], ack 1, win 128, options [nop,nop,TS val 1314685604 ecr 1314685604], length 0
E..4..@.@.\(................w6.a.....(.....
N\..N\..
14:59:27.300369 IP6 localhost.54958 > localhost.5000: Flags [S], seq 3404389761, win 65535, options [mss 65476,sackOK,TS val 1107449560 ecr 0,nop,wscale 9], length 0
`..:.(.@.................................................0.........
B.V........	
14:59:27.300383 IP6 localhost.5000 > localhost.54958: Flags [R.], seq 0, ack 3404389762, win 0, length 0
`
.O...@............................................P.......
14:59:27.300767 IP localhost.39064 > localhost.5000: Flags [S], seq 3186802597, win 65535, options [mss 65495,sackOK,TS val 1314685606 ecr 0,nop,wscale 9], length 0
E..<r.@.@............................0.........
N\.........	
14:59:27.300786 IP localhost.5000 > localhost.39064: Flags [S.], seq 3166632745, ack 3186802598, win 65535, options [mss 65495,sackOK,TS val 1314685606 ecr 1314685606,nop,wscale 9], length 0
E..<..@.@.<................).........0.........
N\..N\.....	
14:59:27.300801 IP localhost.39064 > localhost.5000: Flags [.], ack 1, win 128, options [nop,nop,TS val 1314685606 ecr 1314685606], length 0
E..4r.@.@......................*.....(.....
N\..N\..
14:59:27.301244 IP localhost.39020 > localhost.5000: Flags [F.], seq 789, ack 299, win 384, options [nop,nop,TS val 1314685606 ecr 1314685598], length 0
E..47S@.@..o.........l..le.zz).].....(.....
N\..N\..
14:59:27.301502 IP localhost.5000 > localhost.39020: Flags [F.], seq 299, ack 790, win 384, options [nop,nop,TS val 1314685606 ecr 1314685606], length 0
E..4>d@.@..]...........lz).]le.{.....(.....
N\..N\..
14:59:27.301537 IP localhost.39020 > localhost.5000: Flags [.], ack 300, win 384, options [nop,nop,TS val 1314685606 ecr 1314685606], length 0
E..47T@.@..n.........l..le.{z).^.....(.....
N\..N\..
14:59:27.301880 IP localhost.39034 > localhost.5000: Flags [P.], seq 1:718, ack 1, win 128, options [nop,nop,TS val 1314685607 ecr 1314685601], length 717
E...{Z@.@............z.......{Vv...........
N\..N\..POST /api/log HTTP/1.1
Host: localhost:5000
Connection: keep-alive
Content-Length: 68
sec-ch-ua-platform: "Android"
User-Agent: Mozilla/5.0 (Linux; Android 10; K) AppleWebKit/537.36 (KHTML, like Gecko) Chrome/138.0.0.0 Mobile Safari/537.36
sec-ch-ua: "Not)A;Brand";v="8", "Chromium";v="138", "DuckDuckGo";v="138"
Content-Type: application/json
sec-ch-ua-mobile: ?1
Accept: */*
Origin: http://localhost:3000
X-Requested-With: com.duckduckgo.mobile.android
Sec-Fetch-Site: same-site
Sec-Fetch-Mode: cors
Sec-Fetch-Dest: empty
Referer: http://localhost:3000/
Accept-Encoding: gzip, deflate, br, zstd
Accept-Language: en-US,en;q=0.9

{"level":"log","message":"[\"CryptoAnalysis component rendering\"]"}
14:59:27.301908 IP localhost.5000 > localhost.39034: Flags [.], ack 718, win 384, options [nop,nop,TS val 1314685607 ecr 1314685607], length 0
E..4'u@.@..M...........z.{Vv.........(.....
N\..N\..
14:59:27.302092 IP localhost.39048 > localhost.5000: Flags [P.], seq 1:789, ack 1, win 128, options [nop,nop,TS val 1314685607 ecr 1314685604], length 788
E..H..@.@.Y.................w6.a.....=.....
N\..N\..POST /api/log HTTP/1.1
Host: localhost:5000
Connection: keep-alive
Content-Length: 138
sec-ch-ua-platform: "Android"
User-Agent: Mozilla/5.0 (Linux; Android 10; K) AppleWebKit/537.36 (KHTML, like Gecko) Chrome/138.0.0.0 Mobile Safari/537.36
sec-ch-ua: "Not)A;Brand";v="8", "Chromium";v="138", "DuckDuckGo";v="138"
Content-Type: application/json
sec-ch-ua-mobile: ?1
Accept: */*
Origin: http://localhost:3000
X-Requested-With: com.duckduckgo.mobile.android
Sec-Fetch-Site: same-site
Sec-Fetch-Mode: cors
Sec-Fetch-Dest: empty
Referer: http://localhost:3000/
Accept-Encoding: gzip, deflate, br, zstd
Accept-Language: en-US,en;q=0.9

{"level":"log","message":"[\"CryptoAnalysis - cryptosLoading: true, strategiesLoading: true, configLoading: true, apiIsLoading: false\"]"}
14:59:27.302113 IP localhost.5000 > localhost.39048: Flags [.], ack 789, win 384, options [nop,nop,TS val 1314685607 ecr 1314685607], length 0
E..4.i@.@..X............w6.a.........(.....
N\..N\..
14:59:27.302284 IP localhost.39064 > localhost.5000: Flags [P.], seq 1:718, ack 1, win 128, options [nop,nop,TS val 1314685607 ecr 1314685606], length 717
E...r.@.@......................*...........
N\..N\..POST /api/log HTTP/1.1
Host: localhost:5000
Connection: keep-alive
Content-Length: 68
sec-ch-ua-platform: "Android"
User-Agent: Mozilla/5.0 (Linux; Android 10; K) AppleWebKit/537.36 (KHTML, like Gecko) Chrome/138.0.0.0 Mobile Safari/537.36
sec-ch-ua: "Not)A;Brand";v="8", "Chromium";v="138", "DuckDuckGo";v="138"
Content-Type: application/json
sec-ch-ua-mobile: ?1
Accept: */*
Origin: http://localhost:3000
X-Requested-With: com.duckduckgo.mobile.android
Sec-Fetch-Site: same-site
Sec-Fetch-Mode: cors
Sec-Fetch-Dest: empty
Referer: http://localhost:3000/
Accept-Encoding: gzip, deflate, br, zstd
Accept-Language: en-US,en;q=0.9

{"level":"log","message":"[\"CryptoAnalysis component rendering\"]"}
14:59:27.302308 IP localhost.5000 > localhost.39064: Flags [.], ack 718, win 384, options [nop,nop,TS val 1314685607 ecr 1314685607], length 0
E..4BI@.@..x...............*...s.....(.....
N\..N\..
14:59:27.311534 IP localhost.5000 > localhost.39034: Flags [P.], seq 1:273, ack 718, win 384, options [nop,nop,TS val 1314685616 ecr 1314685607], length 272
E..D'v@.@..<...........z.{Vv.........8.....
N\..N\..HTTP/1.1 200 OK
Server: Werkzeug/2.3.7 Python/3.12.11
Date: Sun, 24 Aug 2025 12:59:27 GMT
Content-Type: application/json
Content-Length: 26
Access-Control-Allow-Origin: http://localhost:3000
Access-Control-Allow-Credentials: true
Vary: Origin
Connection: close


14:59:27.311660 IP localhost.39034 > localhost.5000: Flags [.], ack 273, win 384, options [nop,nop,TS val 1314685616 ecr 1314685616], length 0
E..4{[@.@..f.........z.......{W......(.....
N\..N\..
14:59:27.311924 IP localhost.5000 > localhost.39034: Flags [P.], seq 273:299, ack 718, win 384, options [nop,nop,TS val 1314685617 ecr 1314685616], length 26
E..N'w@.@..1...........z.{W..........B.....
N\..N\..{
  "status": "success"
}

14:59:27.311952 IP localhost.39034 > localhost.5000: Flags [.], ack 299, win 384, options [nop,nop,TS val 1314685617 ecr 1314685617], length 0
E..4{\@.@..e.........z.......{W......(.....
N\..N\..
14:59:27.312028 IP localhost.5000 > localhost.39048: Flags [P.], seq 1:273, ack 789, win 384, options [nop,nop,TS val 1314685617 ecr 1314685607], length 272
E..D.j@.@..G............w6.a.........8.....
N\..N\..HTTP/1.1 200 OK
Server: Werkzeug/2.3.7 Python/3.12.11
Date: Sun, 24 Aug 2025 12:59:27 GMT
Content-Type: application/json
Content-Length: 26
Access-Control-Allow-Origin: http://localhost:3000
Access-Control-Allow-Credentials: true
Vary: Origin
Connection: close


14:59:27.312070 IP localhost.39048 > localhost.5000: Flags [.], ack 273, win 384, options [nop,nop,TS val 1314685617 ecr 1314685617], length 0
E..4..@.@.\&................w6.q.....(.....
N\..N\..
14:59:27.312170 IP localhost.5000 > localhost.39064: Flags [P.], seq 1:273, ack 718, win 384, options [nop,nop,TS val 1314685617 ecr 1314685607], length 272
E..DBJ@.@..g...............*...s.....8.....
N\..N\..HTTP/1.1 200 OK
Server: Werkzeug/2.3.7 Python/3.12.11
Date: Sun, 24 Aug 2025 12:59:27 GMT
Content-Type: application/json
Content-Length: 26
Access-Control-Allow-Origin: http://localhost:3000
Access-Control-Allow-Credentials: true
Vary: Origin
Connection: close


14:59:27.312206 IP localhost.39064 > localhost.5000: Flags [.], ack 273, win 384, options [nop,nop,TS val 1314685617 ecr 1314685617], length 0
E..4r.@.@..................s...:.....(.....
N\..N\..
14:59:27.312332 IP localhost.5000 > localhost.39048: Flags [P.], seq 273:299, ack 789, win 384, options [nop,nop,TS val 1314685617 ecr 1314685617], length 26
E..N.k@.@..<............w6.q.........B.....
N\..N\..{
  "status": "success"
}

14:59:27.312359 IP localhost.39048 > localhost.5000: Flags [.], ack 299, win 384, options [nop,nop,TS val 1314685617 ecr 1314685617], length 0
E..4..@.@.\%................w6.......(.....
N\..N\..
14:59:27.312566 IP localhost.5000 > localhost.39064: Flags [P.], seq 273:299, ack 718, win 384, options [nop,nop,TS val 1314685617 ecr 1314685617], length 26
E..NBK@.@..\...............:...s.....B.....
N\..N\..{
  "status": "success"
}

14:59:27.312599 IP localhost.39064 > localhost.5000: Flags [.], ack 299, win 384, options [nop,nop,TS val 1314685617 ecr 1314685617], length 0
E..4r.@.@..................s...T.....(.....
N\..N\..
14:59:27.314110 IP localhost.39034 > localhost.5000: Flags [F.], seq 718, ack 299, win 384, options [nop,nop,TS val 1314685619 ecr 1314685617], length 0
E..4{]@.@..d.........z.......{W......(.....
N\..N\..
14:59:27.315016 IP localhost.5000 > localhost.39034: Flags [F.], seq 299, ack 719, win 384, options [nop,nop,TS val 1314685620 ecr 1314685619], length 0
E..4'x@.@..J...........z.{W..........(.....
N\..N\..
14:59:27.315113 IP localhost.39034 > localhost.5000: Flags [.], ack 300, win 384, options [nop,nop,TS val 1314685620 ecr 1314685620], length 0
E..4{^@.@..c.........z.......{W......(.....
N\..N\..
14:59:27.315775 IP localhost.39048 > localhost.5000: Flags [F.], seq 789, ack 299, win 384, options [nop,nop,TS val 1314685621 ecr 1314685617], length 0
E..4..@.@.\$................w6.......(.....
N\..N\..
14:59:27.316148 IP localhost.5000 > localhost.39048: Flags [F.], seq 299, ack 790, win 384, options [nop,nop,TS val 1314685621 ecr 1314685621], length 0
E..4.l@.@..U............w6...........(.....
N\..N\..
14:59:27.316214 IP localhost.39048 > localhost.5000: Flags [.], ack 300, win 384, options [nop,nop,TS val 1314685621 ecr 1314685621], length 0
E..4..@.@.\#................w6.......(.....
N\..N\..
14:59:27.316442 IP localhost.39064 > localhost.5000: Flags [F.], seq 718, ack 299, win 384, options [nop,nop,TS val 1314685621 ecr 1314685617], length 0
E..4r.@.@..................s...T.....(.....
N\..N\..
14:59:27.316858 IP localhost.5000 > localhost.39064: Flags [F.], seq 299, ack 719, win 384, options [nop,nop,TS val 1314685622 ecr 1314685621], length 0
E..4BL@.@..u...............T...t.....(.....
N\..N\..
14:59:27.316913 IP localhost.39064 > localhost.5000: Flags [.], ack 300, win 384, options [nop,nop,TS val 1314685622 ecr 1314685622], length 0
E..4r.@.@..................t...U.....(.....
N\..N\..
14:59:31.321470 IP6 localhost.54972 > localhost.5000: Flags [S], seq 285100327, win 65535, options [mss 65476,sackOK,TS val 1107453581 ecr 0,nop,wscale 9], length 0
`....(.@......................................I'.........0.........
B.f........	
14:59:31.321511 IP6 localhost.5000 > localhost.54972: Flags [R.], seq 0, ack 285100328, win 0, length 0
`..0...@..........................................I(P.......
14:59:31.322989 IP localhost.39066 > localhost.5000: Flags [S], seq 1047313273, win 65535, options [mss 65495,sackOK,TS val 1314689627 ecr 0,nop,wscale 9], length 0
E..<Km@.@..L............>l.y.........0.........
N\.[.......	
14:59:31.323075 IP localhost.5000 > localhost.39066: Flags [S.], seq 4030855373, ack 1047313274, win 65535, options [mss 65495,sackOK,TS val 1314689628 ecr 1314689627,nop,wscale 9], length 0
E..<..@.@.<..............A..>l.z.....0.........
N\.\N\.[...	
14:59:31.323186 IP localhost.39066 > localhost.5000: Flags [.], ack 1, win 128, options [nop,nop,TS val 1314689628 ecr 1314689628], length 0
E..4Kn@.@..S............>l.z.A.......(.....
N\.\N\.\
14:59:31.326167 IP6 localhost.54988 > localhost.5000: Flags [S], seq 102344135, win 65535, options [mss 65476,sackOK,TS val 1107453586 ecr 0,nop,wscale 9], length 0
`..o.(.@.................................................0.........
B.f........	
14:59:31.326254 IP6 localhost.5000 > localhost.54988: Flags [R.], seq 0, ack 102344136, win 0, length 0
`.^....@............................................P.......
14:59:31.327991 IP localhost.39076 > localhost.5000: Flags [S], seq 681708987, win 65535, options [mss 65495,sackOK,TS val 1314689632 ecr 0,nop,wscale 9], length 0
E..<.|@.@.m=............(............0.........
N\.`.......	
14:59:31.328119 IP localhost.5000 > localhost.39076: Flags [S.], seq 850115845, ack 681708988, win 65535, options [mss 65495,sackOK,TS val 1314689633 ecr 1314689632,nop,wscale 9], length 0
E..<..@.@.<.............2...(........0.........
N\.aN\.`...	
14:59:31.328241 IP localhost.39076 > localhost.5000: Flags [.], ack 1, win 128, options [nop,nop,TS val 1314689633 ecr 1314689633], length 0
E..4.}@.@.mD............(...2........(.....
N\.aN\.a
14:59:31.329170 IP localhost.39066 > localhost.5000: Flags [P.], seq 1:557, ack 1, win 128, options [nop,nop,TS val 1314689634 ecr 1314689628], length 556
E..`Ko@.@..&............>l.z.A.......U.....
N\.bN\.\OPTIONS /api/log HTTP/1.1
Host: localhost:5000
Connection: keep-alive
Accept: */*
Access-Control-Request-Method: POST
Access-Control-Request-Headers: content-type
Origin: http://localhost:3000
User-Agent: Mozilla/5.0 (Linux; Android 10; K) AppleWebKit/537.36 (KHTML, like Gecko) Chrome/138.0.0.0 Mobile Safari/537.36
Sec-Fetch-Mode: cors
X-Requested-With: com.duckduckgo.mobile.android
Sec-Fetch-Site: same-site
Sec-Fetch-Dest: empty
Referer: http://localhost:3000/
Accept-Encoding: gzip, deflate, br, zstd
Accept-Language: en-US,en;q=0.9


14:59:31.329213 IP localhost.5000 > localhost.39066: Flags [.], ack 557, win 384, options [nop,nop,TS val 1314689634 ecr 1314689634], length 0
E..4.R@.@.No.............A..>l.......(.....
N\.bN\.b
14:59:31.329350 IP localhost.39076 > localhost.5000: Flags [P.], seq 1:557, ack 1, win 128, options [nop,nop,TS val 1314689634 ecr 1314689633], length 556
E..`.~@.@.k.............(...2........U.....
N\.bN\.aOPTIONS /api/log HTTP/1.1
Host: localhost:5000
Connection: keep-alive
Accept: */*
Access-Control-Request-Method: POST
Access-Control-Request-Headers: content-type
Origin: http://localhost:3000
User-Agent: Mozilla/5.0 (Linux; Android 10; K) AppleWebKit/537.36 (KHTML, like Gecko) Chrome/138.0.0.0 Mobile Safari/537.36
Sec-Fetch-Mode: cors
X-Requested-With: com.duckduckgo.mobile.android
Sec-Fetch-Site: same-site
Sec-Fetch-Dest: empty
Referer: http://localhost:3000/
Accept-Encoding: gzip, deflate, br, zstd
Accept-Language: en-US,en;q=0.9


14:59:31.329366 IP localhost.5000 > localhost.39076: Flags [.], ack 557, win 384, options [nop,nop,TS val 1314689634 ecr 1314689634], length 0
E..4..@.@...............2...(........(.....
N\.bN\.b
14:59:31.333165 IP6 localhost.54990 > localhost.5000: Flags [S], seq 3358034363, win 65535, options [mss 65476,sackOK,TS val 1107453593 ecr 0,nop,wscale 9], length 0
`..v.(.@.....................................'...........0.........
B.f........	
14:59:31.333242 IP6 localhost.5000 > localhost.54990: Flags [R.], seq 0, ack 3358034364, win 0, length 0
`.;....@.........................................'..P.......
14:59:31.334197 IP localhost.39080 > localhost.5000: Flags [S], seq 514019072, win 65535, options [mss 65495,sackOK,TS val 1314689639 ecr 0,nop,wscale 9], length 0
E..<7.@.@.................O..........0.........
N\.g.......	
14:59:31.334279 IP localhost.5000 > localhost.39080: Flags [S.], seq 1290212244, ack 514019073, win 65535, options [mss 65495,sackOK,TS val 1314689639 ecr 1314689639,nop,wscale 9], length 0
E..<..@.@.<.............L.....O......0.........
N\.gN\.g...	
14:59:31.334337 IP localhost.39080 > localhost.5000: Flags [.], ack 1, win 128, options [nop,nop,TS val 1314689639 ecr 1314689639], length 0
E..47.@.@.................O.L........(.....
N\.gN\.g
14:59:31.335097 IP localhost.5000 > localhost.39066: Flags [P.], seq 1:433, ack 557, win 384, options [nop,nop,TS val 1314689640 ecr 1314689634], length 432
E....S@.@.L..............A..>l.............
N\.hN\.bHTTP/1.1 200 OK
Server: Werkzeug/2.3.7 Python/3.12.11
Date: Sun, 24 Aug 2025 12:59:31 GMT
Content-Type: text/html; charset=utf-8
Allow: HEAD, GET, OPTIONS, POST
Access-Control-Allow-Origin: http://localhost:3000
Access-Control-Allow-Credentials: true
Access-Control-Allow-Headers: content-type
Access-Control-Allow-Methods: DELETE, GET, HEAD, OPTIONS, PATCH, POST, PUT
Vary: Origin
Content-Length: 0
Connection: close


14:59:31.335121 IP localhost.39066 > localhost.5000: Flags [.], ack 433, win 384, options [nop,nop,TS val 1314689640 ecr 1314689640], length 0
E..4Kp@.@..Q............>l...A.~.....(.....
N\.hN\.h
14:59:31.335489 IP localhost.5000 > localhost.39076: Flags [P.], seq 1:433, ack 557, win 384, options [nop,nop,TS val 1314689640 ecr 1314689634], length 432
E.....@.@..]............2...(..............
N\.hN\.bHTTP/1.1 200 OK
Server: Werkzeug/2.3.7 Python/3.12.11
Date: Sun, 24 Aug 2025 12:59:31 GMT
Content-Type: text/html; charset=utf-8
Allow: HEAD, GET, OPTIONS, POST
Access-Control-Allow-Origin: http://localhost:3000
Access-Control-Allow-Credentials: true
Access-Control-Allow-Headers: content-type
Access-Control-Allow-Methods: DELETE, GET, HEAD, OPTIONS, PATCH, POST, PUT
Vary: Origin
Content-Length: 0
Connection: close


14:59:31.335508 IP localhost.39076 > localhost.5000: Flags [.], ack 433, win 384, options [nop,nop,TS val 1314689640 ecr 1314689640], length 0
E..4..@.@.mB............(...2........(.....
N\.hN\.h
14:59:31.336627 IP6 localhost.55000 > localhost.5000: Flags [S], seq 2889824640, win 65535, options [mss 65476,sackOK,TS val 1107453596 ecr 0,nop,wscale 9], length 0
`..g.(.@.....................................?9..........0.........
B.f........	
14:59:31.336673 IP6 localhost.5000 > localhost.55000: Flags [R.], seq 0, ack 2889824641, win 0, length 0
`.. ...@.........................................?9.P.......
14:59:31.337617 IP localhost.39082 > localhost.5000: Flags [S], seq 1125878381, win 65535, options [mss 65495,sackOK,TS val 1314689642 ecr 0,nop,wscale 9], length 0
E..<,]@.@..]............C..m.........0.........
N\.j.......	
14:59:31.337685 IP localhost.5000 > localhost.39082: Flags [S.], seq 2708327403, ack 1125878382, win 65535, options [mss 65495,sackOK,TS val 1314689642 ecr 1314689642,nop,wscale 9], length 0
E..<..@.@.<..............m..C..n.....0.........
N\.jN\.j...	
14:59:31.337825 IP localhost.39082 > localhost.5000: Flags [.], ack 1, win 128, options [nop,nop,TS val 1314689643 ecr 1314689642], length 0
E..4,^@.@..d............C..n.m.......(.....
N\.kN\.j
14:59:31.340138 IP localhost.39066 > localhost.5000: Flags [F.], seq 557, ack 433, win 384, options [nop,nop,TS val 1314689645 ecr 1314689640], length 0
E..4Kq@.@..P............>l...A.~.....(.....
N\.mN\.h
14:59:31.340415 IP localhost.5000 > localhost.39066: Flags [F.], seq 433, ack 558, win 384, options [nop,nop,TS val 1314689645 ecr 1314689645], length 0
E..4.T@.@.Nm.............A.~>l.......(.....
N\.mN\.m
14:59:31.340465 IP localhost.39066 > localhost.5000: Flags [.], ack 434, win 384, options [nop,nop,TS val 1314689645 ecr 1314689645], length 0
E..4Kr@.@..O............>l...A.......(.....
N\.mN\.m
14:59:31.341178 IP localhost.39076 > localhost.5000: Flags [F.], seq 557, ack 433, win 384, options [nop,nop,TS val 1314689646 ecr 1314689640], length 0
E..4..@.@.mA............(...2........(.....
N\.nN\.h
14:59:31.341422 IP localhost.5000 > localhost.39076: Flags [F.], seq 433, ack 558, win 384, options [nop,nop,TS val 1314689646 ecr 1314689646], length 0
E..4..@.@...............2...(........(.....
N\.nN\.n
14:59:31.341463 IP localhost.39076 > localhost.5000: Flags [.], ack 434, win 384, options [nop,nop,TS val 1314689646 ecr 1314689646], length 0
E..4..@.@.m@............(...2........(.....
N\.nN\.n
14:59:31.343031 IP localhost.39080 > localhost.5000: Flags [P.], seq 1:557, ack 1, win 128, options [nop,nop,TS val 1314689648 ecr 1314689639], length 556
E..`7.@.@.................O.L........U.....
N\.pN\.gOPTIONS /api/log HTTP/1.1
Host: localhost:5000
Connection: keep-alive
Accept: */*
Access-Control-Request-Method: POST
Access-Control-Request-Headers: content-type
Origin: http://localhost:3000
User-Agent: Mozilla/5.0 (Linux; Android 10; K) AppleWebKit/537.36 (KHTML, like Gecko) Chrome/138.0.0.0 Mobile Safari/537.36
Sec-Fetch-Mode: cors
X-Requested-With: com.duckduckgo.mobile.android
Sec-Fetch-Site: same-site
Sec-Fetch-Dest: empty
Referer: http://localhost:3000/
Accept-Encoding: gzip, deflate, br, zstd
Accept-Language: en-US,en;q=0.9


14:59:31.343201 IP localhost.5000 > localhost.39080: Flags [.], ack 557, win 384, options [nop,nop,TS val 1314689648 ecr 1314689648], length 0
E..4
.@.@.1.............L.....Q-.....(.....
N\.pN\.p
14:59:31.343854 IP localhost.39082 > localhost.5000: Flags [P.], seq 1:557, ack 1, win 128, options [nop,nop,TS val 1314689649 ecr 1314689642], length 556
E..`,_@.@..7............C..n.m.......U.....
N\.qN\.jOPTIONS /api/log HTTP/1.1
Host: localhost:5000
Connection: keep-alive
Accept: */*
Access-Control-Request-Method: POST
Access-Control-Request-Headers: content-type
Origin: http://localhost:3000
User-Agent: Mozilla/5.0 (Linux; Android 10; K) AppleWebKit/537.36 (KHTML, like Gecko) Chrome/138.0.0.0 Mobile Safari/537.36
Sec-Fetch-Mode: cors
X-Requested-With: com.duckduckgo.mobile.android
Sec-Fetch-Site: same-site
Sec-Fetch-Dest: empty
Referer: http://localhost:3000/
Accept-Encoding: gzip, deflate, br, zstd
Accept-Language: en-US,en;q=0.9


14:59:31.343911 IP localhost.5000 > localhost.39082: Flags [.], ack 557, win 384, options [nop,nop,TS val 1314689649 ecr 1314689649], length 0
E..4..@.@................m..C........(.....
N\.qN\.q
14:59:31.349007 IP6 localhost.55006 > localhost.5000: Flags [S], seq 2406610663, win 65535, options [mss 65476,sackOK,TS val 1107453609 ecr 0,nop,wscale 9], length 0
`.;..(.@.....................................q...........0.........
B.f........	
14:59:31.349038 IP6 localhost.5000 > localhost.55006: Flags [R.], seq 0, ack 2406610664, win 0, length 0
`......@.........................................q..P.......
14:59:31.349745 IP localhost.39098 > localhost.5000: Flags [S], seq 1882753579, win 65535, options [mss 65495,sackOK,TS val 1314689654 ecr 0,nop,wscale 9], length 0
E..<o.@.@...............p8.+.........0.........
N\.v.......	
14:59:31.349785 IP localhost.5000 > localhost.39098: Flags [S.], seq 932228775, ack 1882753580, win 65535, options [mss 65495,sackOK,TS val 1314689655 ecr 1314689654,nop,wscale 9], length 0
E..<..@.@.<.............7...p8.,.....0.........
N\.wN\.v...	
14:59:31.349816 IP localhost.39098 > localhost.5000: Flags [.], ack 1, win 128, options [nop,nop,TS val 1314689655 ecr 1314689655], length 0
E..4o.@.@...............p8.,7........(.....
N\.wN\.w
14:59:31.350427 IP localhost.39098 > localhost.5000: Flags [P.], seq 1:718, ack 1, win 128, options [nop,nop,TS val 1314689655 ecr 1314689655], length 717
E...o.@.@..F............p8.,7..............
N\.wN\.wPOST /api/log HTTP/1.1
Host: localhost:5000
Connection: keep-alive
Content-Length: 68
sec-ch-ua-platform: "Android"
User-Agent: Mozilla/5.0 (Linux; Android 10; K) AppleWebKit/537.36 (KHTML, like Gecko) Chrome/138.0.0.0 Mobile Safari/537.36
sec-ch-ua: "Not)A;Brand";v="8", "Chromium";v="138", "DuckDuckGo";v="138"
Content-Type: application/json
sec-ch-ua-mobile: ?1
Accept: */*
Origin: http://localhost:3000
X-Requested-With: com.duckduckgo.mobile.android
Sec-Fetch-Site: same-site
Sec-Fetch-Mode: cors
Sec-Fetch-Dest: empty
Referer: http://localhost:3000/
Accept-Encoding: gzip, deflate, br, zstd
Accept-Language: en-US,en;q=0.9

{"level":"log","message":"[\"CryptoAnalysis component rendering\"]"}
14:59:31.350447 IP localhost.5000 > localhost.39098: Flags [.], ack 718, win 384, options [nop,nop,TS val 1314689655 ecr 1314689655], length 0
E..4o\@.@..e............7...p8.......(.....
N\.wN\.w
14:59:31.350753 IP localhost.5000 > localhost.39080: Flags [P.], seq 1:433, ack 557, win 384, options [nop,nop,TS val 1314689656 ecr 1314689648], length 432
E...
.@.@.0.............L.....Q-...........
N\.xN\.pHTTP/1.1 200 OK
Server: Werkzeug/2.3.7 Python/3.12.11
Date: Sun, 24 Aug 2025 12:59:31 GMT
Content-Type: text/html; charset=utf-8
Allow: HEAD, GET, OPTIONS, POST
Access-Control-Allow-Origin: http://localhost:3000
Access-Control-Allow-Credentials: true
Access-Control-Allow-Headers: content-type
Access-Control-Allow-Methods: DELETE, GET, HEAD, OPTIONS, PATCH, POST, PUT
Vary: Origin
Content-Length: 0
Connection: close


14:59:31.350792 IP localhost.39080 > localhost.5000: Flags [.], ack 433, win 384, options [nop,nop,TS val 1314689656 ecr 1314689656], length 0
E..47.@.@.................Q-L..E.....(.....
N\.xN\.x
14:59:31.351564 IP localhost.39080 > localhost.5000: Flags [F.], seq 557, ack 433, win 384, options [nop,nop,TS val 1314689656 ecr 1314689656], length 0
E..47.@.@.................Q-L..E.....(.....
N\.xN\.x
14:59:31.351692 IP localhost.5000 > localhost.39082: Flags [P.], seq 1:433, ack 557, win 384, options [nop,nop,TS val 1314689656 ecr 1314689649], length 432
E.....@.@................m..C..............
N\.xN\.qHTTP/1.1 200 OK
Server: Werkzeug/2.3.7 Python/3.12.11
Date: Sun, 24 Aug 2025 12:59:31 GMT
Content-Type: text/html; charset=utf-8
Allow: HEAD, GET, OPTIONS, POST
Access-Control-Allow-Origin: http://localhost:3000
Access-Control-Allow-Credentials: true
Access-Control-Allow-Headers: content-type
Access-Control-Allow-Methods: DELETE, GET, HEAD, OPTIONS, PATCH, POST, PUT
Vary: Origin
Content-Length: 0
Connection: close


14:59:31.351712 IP localhost.39082 > localhost.5000: Flags [.], ack 433, win 384, options [nop,nop,TS val 1314689656 ecr 1314689656], length 0
E..4,`@.@..b............C....m.......(.....
N\.xN\.x
14:59:31.352179 IP localhost.5000 > localhost.39080: Flags [F.], seq 433, ack 558, win 384, options [nop,nop,TS val 1314689657 ecr 1314689656], length 0
E..4
.@.@.1.............L..E..Q......(.....
N\.yN\.x
14:59:31.352215 IP localhost.39080 > localhost.5000: Flags [.], ack 434, win 384, options [nop,nop,TS val 1314689657 ecr 1314689657], length 0
E..47.@.@.................Q.L..F.....(.....
N\.yN\.y
14:59:31.353068 IP6 localhost.55012 > localhost.5000: Flags [S], seq 3828051834, win 65535, options [mss 65476,sackOK,TS val 1107453613 ecr 0,nop,wscale 9], length 0
`..S.(.@.....................................+oz.........0.........
B.f........	
14:59:31.353113 IP6 localhost.5000 > localhost.55012: Flags [R.], seq 0, ack 3828051835, win 0, length 0
`......@.........................................+o{P.......
14:59:31.353927 IP localhost.39104 > localhost.5000: Flags [S], seq 4130953998, win 65535, options [mss 65495,sackOK,TS val 1314689659 ecr 0,nop,wscale 9], length 0
E..< .@.@................9[..........0.........
N\.{.......	
14:59:31.353980 IP localhost.5000 > localhost.39104: Flags [S.], seq 3550449796, ack 4130953999, win 65535, options [mss 65495,sackOK,TS val 1314689659 ecr 1314689659,nop,wscale 9], length 0
E..<..@.@.<..................9[......0.........
N\.{N\.{...	
14:59:31.354018 IP localhost.39104 > localhost.5000: Flags [.], ack 1, win 128, options [nop,nop,TS val 1314689659 ecr 1314689659], length 0
E..4 .@.@................9[..........(.....
N\.{N\.{
14:59:31.355019 IP localhost.39082 > localhost.5000: Flags [F.], seq 557, ack 433, win 384, options [nop,nop,TS val 1314689660 ecr 1314689656], length 0
E..4,a@.@..a............C....m.......(.....
N\.|N\.x
14:59:31.355970 IP localhost.5000 > localhost.39082: Flags [F.], seq 433, ack 558, win 384, options [nop,nop,TS val 1314689661 ecr 1314689660], length 0
E..4..@.@................m..C........(.....
N\.}N\.|
14:59:31.356013 IP localhost.39082 > localhost.5000: Flags [.], ack 434, win 384, options [nop,nop,TS val 1314689661 ecr 1314689661], length 0
E..4,b@.@..`............C....m.......(.....
N\.}N\.}
14:59:31.356602 IP localhost.39104 > localhost.5000: Flags [P.], seq 1:790, ack 1, win 128, options [nop,nop,TS val 1314689661 ecr 1314689659], length 789
E..I .@.@................9[..........>.....
N\.}N\.{POST /api/log HTTP/1.1
Host: localhost:5000
Connection: keep-alive
Content-Length: 139
sec-ch-ua-platform: "Android"
User-Agent: Mozilla/5.0 (Linux; Android 10; K) AppleWebKit/537.36 (KHTML, like Gecko) Chrome/138.0.0.0 Mobile Safari/537.36
sec-ch-ua: "Not)A;Brand";v="8", "Chromium";v="138", "DuckDuckGo";v="138"
Content-Type: application/json
sec-ch-ua-mobile: ?1
Accept: */*
Origin: http://localhost:3000
X-Requested-With: com.duckduckgo.mobile.android
Sec-Fetch-Site: same-site
Sec-Fetch-Mode: cors
Sec-Fetch-Dest: empty
Referer: http://localhost:3000/
Accept-Encoding: gzip, deflate, br, zstd
Accept-Language: en-US,en;q=0.9

{"level":"log","message":"[\"CryptoAnalysis - cryptosLoading: false, strategiesLoading: true, configLoading: true, apiIsLoading: false\"]"}
14:59:31.356633 IP localhost.5000 > localhost.39104: Flags [.], ack 790, win 384, options [nop,nop,TS val 1314689661 ecr 1314689661], length 0
E..4..@.@.E..................9^$.....(.....
N\.}N\.}
14:59:31.362211 IP localhost.5000 > localhost.39098: Flags [P.], seq 1:273, ack 718, win 384, options [nop,nop,TS val 1314689667 ecr 1314689655], length 272
E..Do]@.@..T............7...p8.......8.....
N\..N\.wHTTP/1.1 200 OK
Server: Werkzeug/2.3.7 Python/3.12.11
Date: Sun, 24 Aug 2025 12:59:31 GMT
Content-Type: application/json
Content-Length: 26
Access-Control-Allow-Origin: http://localhost:3000
Access-Control-Allow-Credentials: true
Vary: Origin
Connection: close


14:59:31.362250 IP localhost.39098 > localhost.5000: Flags [.], ack 273, win 384, options [nop,nop,TS val 1314689667 ecr 1314689667], length 0
E..4o.@.@...............p8..7........(.....
N\..N\..
14:59:31.363024 IP localhost.5000 > localhost.39098: Flags [P.], seq 273:299, ack 718, win 384, options [nop,nop,TS val 1314689668 ecr 1314689667], length 26
E..No^@.@..I............7...p8.......B.....
N\..N\..{
  "status": "success"
}

14:59:31.363039 IP localhost.39098 > localhost.5000: Flags [.], ack 299, win 384, options [nop,nop,TS val 1314689668 ecr 1314689668], length 0
E..4o.@.@...............p8..7........(.....
N\..N\..
14:59:31.363154 IP6 localhost.55018 > localhost.5000: Flags [S], seq 1003426556, win 65535, options [mss 65476,sackOK,TS val 1107453623 ecr 0,nop,wscale 9], length 0
`..s.(.@....................................;............0.........
B.f........	
14:59:31.363212 IP6 localhost.5000 > localhost.55018: Flags [R.], seq 0, ack 1003426557, win 0, length 0
`..g...@........................................;...P.......
14:59:31.363508 IP localhost.5000 > localhost.39104: Flags [P.], seq 1:273, ack 790, win 384, options [nop,nop,TS val 1314689668 ecr 1314689661], length 272
E..D..@.@.D..................9^$.....8.....
N\..N\.}HTTP/1.1 200 OK
Server: Werkzeug/2.3.7 Python/3.12.11
Date: Sun, 24 Aug 2025 12:59:31 GMT
Content-Type: application/json
Content-Length: 26
Access-Control-Allow-Origin: http://localhost:3000
Access-Control-Allow-Credentials: true
Vary: Origin
Connection: close


14:59:31.363546 IP localhost.39104 > localhost.5000: Flags [.], ack 273, win 384, options [nop,nop,TS val 1314689668 ecr 1314689668], length 0
E..4 .@.@................9^$.........(.....
N\..N\..
14:59:31.363606 IP localhost.5000 > localhost.39104: Flags [P.], seq 273:299, ack 790, win 384, options [nop,nop,TS val 1314689668 ecr 1314689668], length 26
E..N. @.@.E..................9^$.....B.....
N\..N\..{
  "status": "success"
}

14:59:31.363631 IP localhost.39104 > localhost.5000: Flags [.], ack 299, win 384, options [nop,nop,TS val 1314689668 ecr 1314689668], length 0
E..4 .@.@................9^$.........(.....
N\..N\..
14:59:31.363934 IP localhost.39120 > localhost.5000: Flags [S], seq 3242449998, win 65535, options [mss 65495,sackOK,TS val 1314689669 ecr 0,nop,wscale 9], length 0
E..<.:@.@................C.N.........0.........
N\.........	
14:59:31.363987 IP localhost.5000 > localhost.39120: Flags [S.], seq 481693403, ack 3242449999, win 65535, options [mss 65495,sackOK,TS val 1314689669 ecr 1314689669,nop,wscale 9], length 0
E..<..@.@.<..................C.O.....0.........
N\..N\.....	
14:59:31.364026 IP localhost.39120 > localhost.5000: Flags [.], ack 1, win 128, options [nop,nop,TS val 1314689669 ecr 1314689669], length 0
E..4.;@.@................C.O.........(.....
N\..N\..
14:59:31.367238 IP6 localhost.55028 > localhost.5000: Flags [S], seq 3770336870, win 65535, options [mss 65476,sackOK,TS val 1107453627 ecr 0,nop,wscale 9], length 0
`.;,.(.@.......................................f.........0.........
B.f........	
14:59:31.367278 IP6 localhost.5000 > localhost.55028: Flags [R.], seq 0, ack 3770336871, win 0, length 0
`......@...........................................gP.......
14:59:31.367905 IP localhost.39122 > localhost.5000: Flags [S], seq 1770764723, win 65535, options [mss 65495,sackOK,TS val 1314689673 ecr 0,nop,wscale 9], length 0
E..<Yi@.@..P............i............0.........
N\.........	
14:59:31.367956 IP localhost.5000 > localhost.39122: Flags [S.], seq 3488178944, ack 1770764724, win 65535, options [mss 65495,sackOK,TS val 1314689673 ecr 1314689673,nop,wscale 9], length 0
E..<..@.@.<...............c.i........0.........
N\..N\.....	
14:59:31.367994 IP localhost.39122 > localhost.5000: Flags [.], ack 1, win 128, options [nop,nop,TS val 1314689673 ecr 1314689673], length 0
E..4Yj@.@..W............i.....c......(.....
N\..N\..
14:59:31.369044 IP localhost.39098 > localhost.5000: Flags [F.], seq 718, ack 299, win 384, options [nop,nop,TS val 1314689674 ecr 1314689668], length 0
E..4o.@.@...............p8..7........(.....
N\..N\..
14:59:31.369348 IP localhost.5000 > localhost.39098: Flags [F.], seq 299, ack 719, win 384, options [nop,nop,TS val 1314689674 ecr 1314689674], length 0
E..4o_@.@..b............7...p8.......(.....
N\..N\..
14:59:31.369401 IP localhost.39098 > localhost.5000: Flags [.], ack 300, win 384, options [nop,nop,TS val 1314689674 ecr 1314689674], length 0
E..4o.@.@...............p8..7........(.....
N\..N\..
14:59:31.369572 IP localhost.39104 > localhost.5000: Flags [F.], seq 790, ack 299, win 384, options [nop,nop,TS val 1314689674 ecr 1314689668], length 0
E..4 .@.@................9^$.........(.....
N\..N\..
14:59:31.369948 IP localhost.5000 > localhost.39104: Flags [F.], seq 299, ack 791, win 384, options [nop,nop,TS val 1314689675 ecr 1314689674], length 0
E..4.!@.@.E..................9^%.....(.....
N\..N\..
14:59:31.370006 IP localhost.39104 > localhost.5000: Flags [.], ack 300, win 384, options [nop,nop,TS val 1314689675 ecr 1314689675], length 0
E..4 .@.@................9^%.........(.....
N\..N\..
14:59:31.370569 IP localhost.39120 > localhost.5000: Flags [P.], seq 1:792, ack 1, win 128, options [nop,nop,TS val 1314689675 ecr 1314689669], length 791
E..K.<@.@..n.............C.O.........@.....
N\..N\..POST /api/log HTTP/1.1
Host: localhost:5000
Connection: keep-alive
Content-Length: 141
sec-ch-ua-platform: "Android"
User-Agent: Mozilla/5.0 (Linux; Android 10; K) AppleWebKit/537.36 (KHTML, like Gecko) Chrome/138.0.0.0 Mobile Safari/537.36
sec-ch-ua: "Not)A;Brand";v="8", "Chromium";v="138", "DuckDuckGo";v="138"
Content-Type: application/json
sec-ch-ua-mobile: ?1
Accept: */*
Origin: http://localhost:3000
X-Requested-With: com.duckduckgo.mobile.android
Sec-Fetch-Site: same-site
Sec-Fetch-Mode: cors
Sec-Fetch-Dest: empty
Referer: http://localhost:3000/
Accept-Encoding: gzip, deflate, br, zstd
Accept-Language: en-US,en;q=0.9

{"level":"log","message":"[\"CryptoAnalysis - cryptosLoading: false, strategiesLoading: false, configLoading: false, apiIsLoading: false\"]"}
14:59:31.370605 IP localhost.5000 > localhost.39120: Flags [.], ack 792, win 384, options [nop,nop,TS val 1314689675 ecr 1314689675], length 0
E..4(.@.@....................C.f.....(.....
N\..N\..
14:59:31.372844 IP localhost.39122 > localhost.5000: Flags [P.], seq 1:718, ack 1, win 128, options [nop,nop,TS val 1314689678 ecr 1314689673], length 717
E...Yk@.@...............i.....c............
N\..N\..POST /api/log HTTP/1.1
Host: localhost:5000
Connection: keep-alive
Content-Length: 68
sec-ch-ua-platform: "Android"
User-Agent: Mozilla/5.0 (Linux; Android 10; K) AppleWebKit/537.36 (KHTML, like Gecko) Chrome/138.0.0.0 Mobile Safari/537.36
sec-ch-ua: "Not)A;Brand";v="8", "Chromium";v="138", "DuckDuckGo";v="138"
Content-Type: application/json
sec-ch-ua-mobile: ?1
Accept: */*
Origin: http://localhost:3000
X-Requested-With: com.duckduckgo.mobile.android
Sec-Fetch-Site: same-site
Sec-Fetch-Mode: cors
Sec-Fetch-Dest: empty
Referer: http://localhost:3000/
Accept-Encoding: gzip, deflate, br, zstd
Accept-Language: en-US,en;q=0.9

{"level":"log","message":"[\"CryptoAnalysis component rendering\"]"}
14:59:31.372883 IP localhost.5000 > localhost.39122: Flags [.], ack 718, win 384, options [nop,nop,TS val 1314689678 ecr 1314689678], length 0
E..4.9@.@.r...............c.i........(.....
N\..N\..
14:59:31.374782 IP localhost.5000 > localhost.39120: Flags [P.], seq 1:273, ack 792, win 384, options [nop,nop,TS val 1314689680 ecr 1314689675], length 272
E..D(.@.@....................C.f.....8.....
N\..N\..HTTP/1.1 200 OK
Server: Werkzeug/2.3.7 Python/3.12.11
Date: Sun, 24 Aug 2025 12:59:31 GMT
Content-Type: application/json
Content-Length: 26
Access-Control-Allow-Origin: http://localhost:3000
Access-Control-Allow-Credentials: true
Vary: Origin
Connection: close


14:59:31.374822 IP localhost.39120 > localhost.5000: Flags [.], ack 273, win 384, options [nop,nop,TS val 1314689680 ecr 1314689680], length 0
E..4.=@.@................C.f.........(.....
N\..N\..
14:59:31.374890 IP localhost.5000 > localhost.39120: Flags [P.], seq 273:299, ack 792, win 384, options [nop,nop,TS val 1314689680 ecr 1314689680], length 26
E..N(.@.@....................C.f.....B.....
N\..N\..{
  "status": "success"
}

14:59:31.374907 IP localhost.39120 > localhost.5000: Flags [.], ack 299, win 384, options [nop,nop,TS val 1314689680 ecr 1314689680], length 0
E..4.>@.@................C.f.........(.....
N\..N\..
14:59:31.375339 IP localhost.39120 > localhost.5000: Flags [F.], seq 792, ack 299, win 384, options [nop,nop,TS val 1314689680 ecr 1314689680], length 0
E..4.?@.@................C.f.........(.....
N\..N\..
14:59:31.376206 IP localhost.5000 > localhost.39120: Flags [F.], seq 299, ack 793, win 384, options [nop,nop,TS val 1314689681 ecr 1314689680], length 0
E..4(.@.@....................C.g.....(.....
N\..N\..
14:59:31.376276 IP localhost.39120 > localhost.5000: Flags [.], ack 300, win 384, options [nop,nop,TS val 1314689681 ecr 1314689681], length 0
E..4.@@.@................C.g.........(.....
N\..N\..
14:59:31.376927 IP localhost.5000 > localhost.39122: Flags [P.], seq 1:273, ack 718, win 384, options [nop,nop,TS val 1314689682 ecr 1314689678], length 272
E..D.:@.@.qw..............c.i........8.....
N\..N\..HTTP/1.1 200 OK
Server: Werkzeug/2.3.7 Python/3.12.11
Date: Sun, 24 Aug 2025 12:59:31 GMT
Content-Type: application/json
Content-Length: 26
Access-Control-Allow-Origin: http://localhost:3000
Access-Control-Allow-Credentials: true
Vary: Origin
Connection: close


14:59:31.376971 IP localhost.39122 > localhost.5000: Flags [.], ack 273, win 384, options [nop,nop,TS val 1314689682 ecr 1314689682], length 0
E..4Yl@.@..U............i.....d......(.....
N\..N\..
14:59:31.377035 IP localhost.5000 > localhost.39122: Flags [P.], seq 273:299, ack 718, win 384, options [nop,nop,TS val 1314689682 ecr 1314689682], length 26
E..N.;@.@.rl..............d.i........B.....
N\..N\..{
  "status": "success"
}

14:59:31.377059 IP localhost.39122 > localhost.5000: Flags [.], ack 299, win 384, options [nop,nop,TS val 1314689682 ecr 1314689682], length 0
E..4Ym@.@..T............i.....d+.....(.....
N\..N\..
14:59:31.377811 IP localhost.39122 > localhost.5000: Flags [F.], seq 718, ack 299, win 384, options [nop,nop,TS val 1314689683 ecr 1314689682], length 0
E..4Yn@.@..S............i.....d+.....(.....
N\..N\..
14:59:31.378114 IP localhost.5000 > localhost.39122: Flags [F.], seq 299, ack 719, win 384, options [nop,nop,TS val 1314689683 ecr 1314689683], length 0
E..4.<@.@.r...............d+i........(.....
N\..N\..
14:59:31.378166 IP localhost.39122 > localhost.5000: Flags [.], ack 300, win 384, options [nop,nop,TS val 1314689683 ecr 1314689683], length 0
E..4Yo@.@..R............i.....d,.....(.....
N\..N\..

296 packets captured
592 packets received by filter
0 packets dropped by kernel
